news_publisher,article_date,article_links,Bias_1,Clickbait Bias_1,Selection Bias_1,Framing Bias_1,Linguistic Bias_1,Ideology Bias_1,Stance Bias_1,Omission Bias_1,Fact Bias_1,Emotional Bias_1,Explanation_1,Bias_2,Clickbait Bias_2,Selection Bias_2,Framing Bias_2,Linguistic Bias_2,Ideology Bias_2,Stance Bias_2,Omission Bias_2,Fact Bias_2,Emotional Bias_2,Explanation_2
Aaj Tak,12/27/2025,https://www.aajtak.in/india/politics/story/congress-mnrega-bachao-andolan-rahul-gandhi-kharge-5-january-ntc-rpti-2424131-2025-12-27,yes,0,0,1,0,0,1,1,0,1,"1.“नोटबंदी की तरह यह फैसला भी अकेले दम पर लिया गया।” -नोटबंदी” is negative frame , 2.अगर मनरेगा नहीं होता तो लाखों लोगों की जान जा सकती थी - unverified emotional statements creates bias , 3.“कांग्रेस ने केंद्र सरकार पर मनरेगा को कमजोर करने का आरोप लगाया - no counter info",yes,0,0,1,0,0,0,1,0,1,"1. ""राहुल गांधी ने MNREGA का नाम बदलने के फैसले को लेकर केंद्र सरकार पर तीखा हमला बोला."", ""कांग्रेस नेतृत्व ने केंद्र सरकार द्वारा मनरेगा (MGNREGA) योजना को कमजोर करने का आरोप लगाते हुए"" => negative framing 2. Omission bias is clear since MNREGA is not explained, only arguments against it are highlighted 3. ""राहुल गांधी बोले- फैसला नोटबंदी जैसा विनाशकारी"", “इस फैसले से आदिवासी, दलित, ओबीसी, अल्पसंख्यक और गरीब सामान्य वर्ग को भारी नुकसान होगा"" => emotional bias caused due to repetitive clustering of emotionally negative quotes together"
Aaj Tak,12/26/2025,https://www.aajtak.in/opinion-analysis-/story/bmc-election-mahayuti-seat-sharing-fadnavis-shinde-ajit-pawar-opnm1-dskc-2422662-2025-12-26,yes,0,0,1,1,0,1,0,0,0,"1.Framing- बीएमसी चुनाव अगर विपक्षी महाविकास आघाड़ी के लिए अस्तित्व की लड़ाई का मैदान है, तो सत्ताधारी महायुति के लिए सियासी वर्चस्व साबित करने का बेहतरीन मौका…”, महायुति की स्थिति भी बहुत ज्यादा अलग तो नहीं है, लेकिन थोड़ी बेहतर लगती है.”, 2. Linguistic- बीजेपी की जिद के सामने एकनाथ शिंदे और अजित पवार की बड़ी दावेदारी…Calling one side “stubborn” implies negative judgment rather than neutral description.",yes,0,0,1,1,0,0,0,0,0,"1. Linguistic: ""बीएमसी चुनाव अगर विपक्षी गठबंधन महाविकास आघाड़ी के लिए अस्तित्व की लड़ाई का मैदान है, तो सत्ताधारी महायुति के लिए सियासी वर्चस्व"" =>exaggeration and loaded words 2. Framing: ""महाराष्ट्र में सत्ताधारी महायुति के लिए बीएमसी चुनाव कितना आसान और कितना मुश्किल?"" =>article framed as an advantage vs disadvantage problem rather than neutral framing"
Aaj Tak,12/26/2025,https://www.aajtak.in/india/politics/story/bjp-makes-history-kerala-winning-thiruvananthapuram-mayor-election-vv-rajesh-ntcpbt-rpti-2423155-2025-12-26,no,0,0,0,0,0,0,0,0,0,,no,0,0,0,0,0,0,0,0,0,
Aaj Tak,12/26/2025,https://www.aajtak.in/opinion-analysis-/story/communist-party-of-india-cpi-hundred-anniversary-where-is-left-front-ideology-politics-as-compared-to-rss-opnm1-dskc-2423030-2025-12-26,yes,0,1,1,1,0,1,1,0,0,"Framing-आरएसएस साल भर से अलग अलग राजनीतिक गतिविधियों में छाया हुआ है, जबकि सीपीआई के समर्थकों की रस्म-अदायगी भर महसूस होती है , “भारतीय जनता पार्टी के केंद्र और देश कई राज्यों में सरकार होने की वजह से प्रभाव बना हुआ है, जबकि सीपीआई महज केरल में सत्ताधारी गठबंधन LDF में एक हिस्सेदार भर रह गई है.” , लेकिन CPI आज कहां, और कितने पानी में है.” Linguistic Bias - मात्र रस्म-अदायगी” (only ceremonial observance)  -- stance/omission -towards RSS than CPI",yes,0,1,1,1,0,1,1,0,0,"1. Framing: ""RSS साल भर से अलग अलग राजनीतिक गतिविधियों में छाया हुआ है, जबकि सीपीआई के समर्थकों की रस्मअदायगी भर महसूस होती है."" => framed as a comparison with RSS being better 2. Linguistic: ""समर्थकों की रस्मअदायगी भर महसूस होती है"", ""जबकि सीपीआई महज"" => usage of terms like 'ceremonial' for CPI 3. Selection and Stance bias clear since CPI's faults are highlighted more than RSS 4. Omission: CPI highlighted more than RSS"
Aaj Tak,12/26/2025,https://www.aajtak.in/opinion-analysis-/story/anti-hate-law-passed-in-the-karnataka-assembly-why-bjp-calling-a-black-law-opns2-dskc-2423035-2025-12-26,yes,1,1,1,0,0,0,1,0,0,"Framing Bias- “कर्नाटक में कांग्रेस सरकार द्वारा हाल ही में विधानसभा के दोनों सदनों में पेश किए गए… काला कानून बताकर विरोध कर रही है.”, क्यों कहा जा रहा कि कर्नाटक का ये कानून पुलिस को हिटलर बना देगा?” ) Omission / Selection Bias- “…लेकिन इस बात से इनकार नहीं किया जा सकता है कि इस तरह के कानूनों का इतना दुरुपयोग होता है कि इसे बनाने के पीछे की मूल भावना ही खत्म हो जाती है.”",yes,1,0,1,1,0,1,0,0,1,"1. Framing: ""कर्नाटक में कांग्रेस सरकार द्वारा…एंटी-हेट बिल...को लेकर काफी बहस हो रही है. भारतीय जनता पार्टी इसे एक काला कानून बताकर विरोध कर रही है."", ""यह कानून राजनीतिक प्रतिशोध, अभिव्यक्ति की स्वतंत्रता को दबाने और चयनात्मक प्रवर्तन के लिए इस्तेमाल किया जा सकता है."" =>law framed as negative from the beginning  2. Stance: “लेकिन इस बात से इनकार नहीं किया जा सकता है कि इस तरह के कानूनों का इतना दुरुपयोग होता है कि”  3. Linguistic: ""इस कानून को दमनकारी, असंवैधानिक या नागरिक अधिकारों का उल्लंघन करने वाला""  4. Emotional bias through repetitive negative implications"
Aaj Tak,12/26/2025,https://www.aajtak.in/madhya-pradesh/story/mp-politics-vishvas-sarang-vs-kamalnath-farmer-loan-waiver-controversy-lcln-dskc-2423062-2025-12-26,no,0,0,0,0,0,0,0,0,0,,no,0,0,0,0,0,0,0,0,0,
Aaj Tak,12/26/2025,https://www.aajtak.in/india/politics/story/narendra-modi-cabinet-6-ministers-rajya-sabha-team-2026-political-challenge-ntcpkb-dskc-2423026-2025-12-26,yes,0,0,1,0,0,0,0,0,0,"Framing Bias - “…विधानसभा में बीजेपी की मजबूत स्थिति है, इसलिए माना जा रहा है कि वह आठ सीटें जीत सकती है…” , …अगर बीजेपी इन्हें राज्यसभा में फिर मौका नहीं देती है तो मंत्रिमंडल से छुट्टी हो जाएगी.”",no,0,0,0,0,0,0,0,0,0,
Aaj Tak,12/25/2025,https://www.aajtak.in/india/politics/story/congress-sam-pitroda-exclusive-rahul-gandhi-germany-visit-ntc-rpti-2422601-2025-12-25,no,0,0,0,0,0,0,0,0,0,,yes,0,1,0,0,0,0,1,0,0,"Selection and Omission bias since only Sam Pitroda's voice is highlighted, and does not include any counterquotes from BJP. Details about Germany trip omitted"
Aaj Tak,12/25/2025,https://www.aajtak.in/india/politics/story/hanuman-chalisa-church-christmas-row-sanjay-singh-raises-questions-ntc-dskc-2422532-2025-12-25,no,0,0,0,0,0,0,0,0,0,,no,0,0,0,0,0,0,0,0,0,
Aaj Tak,12/25/2025,https://www.aajtak.in/madhya-pradesh/story/amit-shah-gwalior-visit-mohan-yadav-more-energetic-than-shivraj-growth-summit-lcln-dskc-2422411-2025-12-25,no,0,0,0,0,0,0,0,0,0,,no,0,0,0,0,0,0,0,0,0,
Aaj Tak,12/25/2025,https://www.aajtak.in/opinion-analysis-/story/nitish-nitin-nabin-rekha-gupta-shinde-pawar-achievers-2025-opnm1-dskc-2422290-2025-12-25,no,0,0,0,0,0,0,0,0,0,,no,0,0,0,0,0,0,0,0,0,
Aaj Tak,12/25/2025,https://www.aajtak.in/india/delhi/story/ajay-mahawar-ghonda-sant-lokeshanand-maharaj-gufadham-sarkar-kartar-nagar-shree-mad-bhagvat-katha-aap-bjp-gaurav-sharma-ntc-dskc-2422195-2025-12-25,no,0,0,0,0,0,0,0,0,0,,no,0,0,0,0,0,0,0,0,0,
Aaj Tak,12/25/2025,https://www.aajtak.in/opinion-analysis-/story/indian-politics-biggest-losers-of-year-2025-tejashwi-kejriwal-rahul-gandhi-opnm1-dskc-2421833-2025-12-25,yes,1,1,1,1,0,1,0,1,0,repeatedly uses  “सबसे बड़े लूजर्स” (“the biggest losers”),yes,1,1,1,1,0,1,0,1,0,"1. Linguistic: ""कहां विपक्ष के नेता भी सबसे निचले पायदान पर बने""  2. Stance and Fact bias: ""बिहार चुनाव के नतीजे ही राहुल गांधी के वोट चोरी कैंपेन का रिजल्ट है. राहुल गांधी का बिहार में वोटर अधिकार यात्रा भी बेकार गया."" => assumes that the election results are the direct outcome of “वोट चोरी कैंपेन” without evidence (the line is a conclusion, not an open statement)  3. Framing: “सबसे बड़े हारे हुए” placed directly in the headline"
Aaj Tak,12/24/2025,https://www.aajtak.in/opinion-analysis-/story/akhlaq-lynching-and-unnao-rape-case-why-convicts-and-accused-are-benefiting-opns2-dskc-2421778-2025-12-24,yes,0,0,1,0,0,0,0,0,0,"ये घटनाएं न केवल पीड़ित परिवारों के घावों को कुरेदती हैं, बल्कि समाज में एक गलत संदेश भी देती हैं कि शक्तिशाली लोग कानून से ऊपर हैं.”",yes,0,0,1,0,0,0,0,0,1,"1. Framing: “आरोपियों और दोषियों को किस बात की ‘राहत’?”  2. Emotional: evokes sympathy for victims and anger toward the system, evoking emotions rather than a logical analysis."
Aaj Tak,12/24/2025,https://www.aajtak.in/india/politics/story/dk-shivakumar-rejects-priyanka-gandhi-pm-rumors-leadership-media-ntcpmm-rpti-2421563-2025-12-24,no,0,0,0,0,0,0,0,0,0,,no,0,0,0,0,0,0,0,0,0,
Aaj Tak,12/24/2025,https://www.aajtak.in/opinion-analysis-/story/bmc-elections-uddhav-raj-thackeray-alliance-challenging-bjp-shinde-pawar-power-struggle-opnm1-dskc-2421358-2025-12-24,yes,0,0,1,0,0,0,0,0,0,,yes,0,0,1,0,0,0,0,0,0,"Framing: ""ठाकरे बंधु बनाम सब"" => frames as a competition "
Aaj Tak,12/23/2025,https://www.aajtak.in/india/politics/story/robert-vadra-backs-priyanka-gandhi-for-prime-minister-ntc-dskc-2420811-2025-12-23,no,0,0,0,0,0,0,0,0,0,,no,0,0,0,0,0,0,0,0,0,
Aaj Tak,12/23/2025,https://www.aajtak.in/opinion-analysis-/story/mamata-banerjee-tmc-mla-temple-mosque-controversy-murshidabad-bengal-election-opnm1-dskc-2420678-2025-12-23,no,0,0,0,0,0,0,0,0,0,,no,0,0,0,0,0,0,0,0,0,
Aaj Tak,12/23/2025,https://www.aajtak.in/india/politics/story/rahul-gandhi-berlin-speech-voter-chori-bjp-reaction-ntc-rptc-2420657-2025-12-23,no,0,0,0,0,0,0,0,0,0,,no,0,0,0,0,0,0,0,0,0,
Aaj Tak,12/23/2025,https://www.aajtak.in/india/politics/story/digvijaya-singh-remark-bangladesh-hindu-attacks-reaction-to-indian-minority-issues-lcln-dskc-2420377-2025-12-23,no,0,0,0,0,0,0,0,0,0,,no,0,0,0,0,0,0,0,0,0,
Aaj Tak,12/23/2025,https://www.aajtak.in/opinion-analysis-/story/2025-india-politics-major-events-controversies-elections-judiciary-opnm1-dskc-2420303-2025-12-23,yes,0,0,1,1,0,0,0,0,0,"Framing Bias -“साल 2025 की वो राजनीतिक घटनाएं, जिन्होंने पूरे देश में उथल-पुथल मचा दी।”,न्यायपालिका भी इस साल विवादों से अछूती नहीं रही। ,ऑपरेशन सिंदूर के बाद देश की राजनीति गरमा गई और विपक्ष ने सरकार को घेरना शुरू कर दिया।” , चुनाव नतीजों ने विपक्ष को बड़ा झटका दिया।”",yes,0,0,1,1,0,0,0,0,0,"1. ऑपरेशन सिंदूर के बाद देश की राजनीति गरमा गई और विपक्ष ने सरकार को घेरना शुरू कर दिया: Framing bias => framed the political response as heated, rather than being merely critical. Linguistic bias is also seen in this"
Aaj Tak,12/23/2025,https://www.aajtak.in/opinion-analysis-/story/has-modi-government-ruined-mnrega-an-assessment-of-sonia-gandhi-allegations-opns2-dskc-2420233-2025-12-23,yes,1,1,1,1,0,1,1,0,0,"“मोदी  स्कीम को बुलडोज कर दिया है।” , “उन्होंने कहा कि सरकार ने पिछले 11 सालों में इसे कमजोर किया और अब VB-G RAM G बिल से इसे पूरी तरह बदल दिया है, जो एक ब्लैक लॉ है।” ",yes,1,1,1,1,0,0,0,1,0,"1. Selection: Sonia Gandhi’s claims and criticisms are highlighted, rather than giving equal space for counter-arguments.  2. Fact bias: ""लेकिन क्रॉनिकल अंडरफंडिंग की बात ओवरस्टेटेड लगता है, क्योंकि मोदी सरकार ने कोविड में एक्स्ट्रा फंड्स दिए. कुल मिलाकर बजट इश्यू रियल है, लेकिन खत्म करने का नहीं, बल्कि मैनेजमेंट का है."" , “तथ्य बताते हैं कि…” (without immediate data)  3. Framing: ""मनरेगा पर बुलडोजर"" , ""क्रॉनिकल अंडरफंडिंग""  4. Linguistic: ""खोखला किया जा रहा है"", ""सरकार की नीयत"""
Aaj Tak,12/22/2025,https://www.aajtak.in/opinion-analysis-/story/humayun-kabir-west-bengal-new-party-launch-after-babri-masjid-and-praising-bhagwat-modi-opnm1-dskc-2419670-2025-12-22,yes,1,1,1,1,0,0,0,1,0,"“कैसे जीतेंगे 100 सीटें? ,“जलेबी पॉलिटिक्स” ,“भागवत भजन” focuses on controversy pushes readers toward a negative perception ,using words like Babri Masjid and jalebi politics to make the leader look confusing",yes,1,1,1,1,0,0,0,1,0,"1. Framing: ""शायद इसीलिए वो अपने खिलाफ एक्शन में थर्ड पार्टी का नाम ले रहे हैं"" => whole article framed as an evaluation of Humayun Kabir's intentions, contains Fact bias too  2. Fact: ""हुमायूं कबीर मुस्लिम वोट के लिए ही पश्चिम बंगाल में बाबरी मस्जिद बनवाना चाहते हैं."" given without any evidence  3. Omission: Complete explanations are not present, thus makes the vote-bank motive appear self-evident. 4. Linguistic: ""कसीदे पढ़ रहे हैं"", “कैसे जीतेंगे 100 सीटें? ,“जलेबी पॉलिटिक्स” ,“भागवत भजन”"
Aaj Tak,12/22/2025,https://www.aajtak.in/india/politics/story/rajya-sabha-2026-election-75-seats-nda-vs-india-sharad-pawar-upendra-kushwaha-hd-devegowda-political-challenges-ntcpkb-dskc-2419394-2025-12-22,yes,0,1,1,1,0,0,1,0,0,"“गज़ब उलझा है गणित” ,“एनडीए बनाम इंडिया”,“वापसी मुश्किल” focuses on presents the Rajya Sabha election who wins, who loses, creating narrative bias.",yes,0,1,1,1,0,0,0,0,0,"1. Framing: ""ऐसे में देखना है कि किस दिग्गज नेता की वापसी होती है और कौन से नए चेहरे की संसद में एंट्री होती है?"" => frames as a competition, not a neutral report  2. Linguistic: “गजब उलझा है”, “दिग्गज नेता”, ""असल इम्तिहान”"
Aaj Tak,12/22/2025,https://www.aajtak.in/opinion-analysis-/story/rss-chief-appeal-for-hindu-safety-support-in-bangladesh-modi-govt-opnm1-dskc-2419378-2025-12-22,yes,0,0,1,1,0,1,0,0,0,"“क्या सरकार सुन रही है?” shows doubt / criticism,“हिंदुओं को निशाना” targeting Hindus,“हिंदुओं का एकमात्र देश भारत” India as the only country for Hindus and suggesting government inaction,",yes,0,1,1,0,0,1,0,0,0,"1. Framing: framed as government inaction, without giving full details “क्या सरकार सुन रही है?”  2. Selection bias as only the voice of one person is shown, topic filtering "
Aaj Tak,12/22/2025,https://www.aajtak.in/opinion-analysis-/story/maharashtra-local-body-election-results-shinde-shiv-sena-take-over-bal-thackeray-legacy-opns2-dskc-2419277-2025-12-22,yes,0,1,1,1,0,0,1,0,0,"“ठाकरे विरासत छीन लिया”,frames Maharashtra local results as a dramatic takeover of  Shiv Sena  makes a conflict-focused narrative instead of a calm, factual overview.",yes,0,1,1,1,0,0,1,0,0,"1. Linguistic: “हद दर्जे की झटके”, “नई राजनीति की परतें”, “प्रभावी कब्ज़ा”  2. Framing: ""पहले सत्ता गई फिर पार्टी भी गई हाथ से. अब पिता की विरासत पर शिंदे शिवसेना कब्जा करते दिख रही है."" => framed as a clash for dominance  3. Topic filtering and exclusion done emphasizing political symbolism over functional governance outcomes"
Aaj Tak,12/22/2025,https://www.aajtak.in/india/maharashtra/story/sanjay-raut-reached-shivtirth-raj-thackeray-residence-shiv-sena-ubt-mns-alliance-bmc-election-ntcpbt-dskc-2419312-2025-12-22,yes,0,0,1,1,0,0,0,0,0,"मराठी और मुस्लिम फैक्टर पर दांव , गठबंधन का आधिकारिक ऐलान से पहले समझौता अंतिम रूप , “क्या यही लोकतंत्र है?” repeatedly frames discussion as strategic power play",yes,0,0,1,1,0,0,0,0,0,"1. Linguistic: “मीटिंग नहीं, संकेत"", “राज तंत्र की राजनीति”  2. Framing: frames the event as a symbolic/strategic theatrics, not just a political meeting."
Aaj Tak,12/20/2025,https://www.aajtak.in/india/news/story/india-bangladesh-relations-parliamentary-panel-report-shashi-tharoor-minority-safety-china-factor-ntc-dskc-2417617-2025-12-20,yes,0,0,1,1,0,0,0,0,0,"अल्पसंख्यक हिंसा, चीन का दखल, सबसे बड़ा खतरा” ,सतर्क रहने की सलाह” =>frames danger, threat, and foreign influence as fear-oriented narrative.",yes,0,0,1,1,0,0,0,0,0,"1. Framing: “भारत-बांग्लादेश संबंधों के सामने नई चुनौतियां खड़ी हो गई हैं” => The relationship is framed upfront as a problem/crisis, not as a neutral diplomatic phase.  2. Linguistic: ""अल्पसंख्यक हिंसा"", ""चीन का दखल"", ""सबसे बड़ा खतरा” , ""सतर्क रहने की सलाह”"
Aaj Tak,12/19/2025,https://www.aajtak.in/india/politics/story/kiren-rijiju-praises-priyanka-gandhi-attacks-rahul-gandhi-ntc-rptc-2417483-2025-12-19,yes,0,0,1,1,0,0,0,0,0,"“अलोकतांत्रिक” , “असभ्य”, “निशाना"" praise for Priyanka Gandhi and criticism of Rahul Gandhi frames story as personality-focused political clash",yes,0,0,1,1,0,0,0,0,0,"1. Framing: “किरन रिजिजू ने प्रियंका गांधी की तारीफ की और राहुल गांधी पर हमला बोला”  2. Linguistic: “आक्रमण किया”, “हमला बोला” => negative, aggressive connotation"
Aaj Tak,12/19/2025,https://www.aajtak.in/india/politics/story/haryana-assembly-no-confidence-motion-saini-bhupendra-singh-hooda-ntcpmm-dskc-2417382-2025-12-19,yes,0,1,0,1,0,0,0,0,0,"1. Selection Bias - The article omits the opposition's voice of objection by not including their reasons for not signing for No Confidence Motion.  2. Linguistic Bias - ""सियासी पारा अचानक चढ़ गया"" is used to over emphasize the situation in the parliament instead of simpler terms.",yes,0,1,0,1,0,0,0,0,0,"1. Linguistic: ""सियासी पारा गरमाया"" , ""सियासी पारा अचानक चढ़ गया"", ""तीखी नोकझोंक"" "
Aaj Tak,12/19/2025,https://www.aajtak.in/opinion-analysis-/story/ex-dgp-prashant-kumar-new-chairman-upessc-challenges-opnm1-dskc-2416953-2025-12-19,yes,0,0,0,1,0,0,0,0,0,,yes,0,0,0,1,0,0,0,0,0,1. Linguistic: “घनघोर चुनौतियां”
Aaj Tak,12/19/2025,https://www.aajtak.in/madhya-pradesh/story/ias-minakshi-says-casteism-is-need-of-the-time-after-santosh-verma-lcln-strc-2416986-2025-12-19,yes,0,1,1,1,0,0,0,0,0,"1. Framing Bias,2. Linguistic Bias - ""जंगल की आग की तरह फैल गया है""",yes,0,1,1,1,0,0,0,0,0,"Linguistic: ""जंगल की आग की तरह फैल गया है.""  2. Framing: “जातिगत पहचान और जातिवादी सोच सबसे बड़ी जरूरत बन चुकी है” => article presents this controversy on the forefront like a broad social narrative rather than contextualising as a person's view"
Aaj Tak,12/19/2025,https://www.aajtak.in/india/politics/story/vbg-ram-g-bill-replace-mgnrega-scheme-modi-goverment-vs-upa-oppotion-party-ntcpkb-dskc-2416864-2025-12-19,no,0,0,0,0,0,0,0,0,0,,no,0,0,0,0,0,0,0,0,0,
Aaj Tak,12/19/2025,https://www.aajtak.in/madhya-pradesh/story/jaivardhan-singh-slams-mp-govt-over-urban-planning-master-plan-failure-lcln-dskc-2416892-2025-12-19,no,0,0,0,0,0,0,0,0,0,,no,0,0,0,0,0,0,0,0,0,
Aaj Tak,12/19/2025,https://www.aajtak.in/opinion-analysis-/story/why-14-year-delay-in-liberating-goa-and-what-nehru-role-opns2-dskc-2416710-2025-12-19,yes,0,0,0,0,1,0,0,0,0,"1. Ideology Bias- Reinterprets an old historical fact to align against the Congress party, which may be irrelavant in the current context.",yes,0,1,1,1,1,1,0,0,0,1. The article shows subtle Ideology Bias by re-interpreting the Goa liberation delay primarily through criticism of Nehru’s diplomatic approach  2. Framing: “क्यों 14 साल ले लिया गोवा को आज़ाद करने में और नेहरू का क्या रोल था?”  3. Linguistic: “नेहरू की नीतियों में कसावट”  4. Selection Bias: selective historical emphasis  5. Stance Bias subtly favors a critical perspective on Nehru’s role
Aaj Tak,12/19/2025,https://www.aajtak.in/india/politics/story/priyanka-gandhi-meets-nitin-gadkari-discusses-wayanad-road-projects-ntc-rpti-2416654-2025-12-19,no,0,0,0,0,0,0,0,0,0,,no,0,0,0,0,0,0,0,0,0,
Aaj Tak,12/18/2025,https://www.aajtak.in/madhya-pradesh/story/children-contracting-hiv-during-treatment-cong-leader-slams-bjp-govt-lcln-dskc-2416509-2025-12-18,yes,0,1,0,0,0,0,0,1,0,1. Fact bias- does not clarify how the transmission occurred,yes,0,1,0,0,0,0,0,1,0,"1. Fact bias: reports that children contracted HIV during treatment, and blames the govt but does not clearly distinguish between claims and verified medical evidence  2. This is a strong Selection Bias because it chooses one political viewpoint without balancing voices."
Aaj Tak,12/18/2025,https://www.aajtak.in/opinion-analysis-/story/why-no-discusion-on-mnrega-or-vb-g-ram-g-scheme-corruption-and-flaws-opns2-dskc-2416448-2025-12-18,yes,0,0,1,0,0,0,0,0,0,,yes,0,1,1,1,0,0,0,0,0,"1. Framing: “क्यों… चर्चा तक नहीं हो पा रही?” frames the topic as a willful lack of discussion of corruption/flaws, not as a neutral question about policy debate.  2. Linguistic: “कमज़ोर नीतियों का सामना”, “खामियों का उजागर होना चाहिए” "
Aaj Tak,12/18/2025,https://www.aajtak.in/india/politics/story/vijay-dmk-corruption-accusations-tamil-nadu-rally-tvk-pure-ntcpmm-rpti-2416395-2025-12-18,yes,1,1,0,0,0,0,0,0,0,1. Clickbait Bias- Terming a win for the state politics is exaggerated for users to click. 2. Selection Bias- This article focusses on the side of politician Vijay and his party Tamilga Vetri Kazhagam and downplays DMK Party.,yes,1,1,0,0,0,0,0,0,0,"The article focuses on the corruption accusations by Vijay against DMK, but does not include DMK’s detailed response or denial"
Aaj Tak,12/18/2025,https://www.aajtak.in/opinion-analysis-/story/lok-sabha-vaping-allegation-kirti-azad-parliamentary-conduct-opnm1-dskc-2416061-2025-12-18,yes,1,0,0,1,0,0,0,0,1,"1. Clickbait Bias- ""वेपिंग कितना बड़ा गुनाह"" Terming this attracts people to the article. 2. Linguistic Bias- ""वेपिंग कितना बड़ा गुनाह"" ",yes,0,0,0,1,0,0,0,0,0,"1. Linguistic: “अश्लील व्यवहार”, ""निंदनीय कृत्य”"
Aaj Tak,12/18/2025,https://www.aajtak.in/opinion-analysis-/story/how-bjp-transforming-a-youth-organisation-compared-to-congress-opns2-dskc-2416048-2025-12-18,yes,0,0,1,0,0,1,0,0,0,1. Stance Bias-  The article is oriented towards BJP and against Congress.,yes,0,0,1,1,0,1,0,0,0,1. Framing: “पिछड़ती राजनीति”  2. Linguistic: “पिछड़ती राजनीति”  3. Stance: Emphasis on one party’s strategy over another with favoring one interpretation
Aaj Tak,12/17/2025,https://www.aajtak.in/india/politics/story/rajya-sabha-ladakh-protesters-release-sanjay-singh-attacks-government-ntc-dskc-2415419-2025-12-17,yes,0,0,1,1,0,0,0,0,0,"1. Framing Bias, 2. Linguistic Bias: ""तीखा"", ""लोकतंत्र का गला घोंटने की साजिश""",yes,0,0,1,1,0,0,0,0,0,"1. Linguistic: ""तीखा हमला""  2. Framing bias: “राज्यसभा में उठाया लद्दाख आंदोलनकारियों की रिहाई का मुद्दा” =>conflict framing"
Aaj Tak,12/17/2025,https://www.aajtak.in/opinion-analysis-/story/nitish-kumar-hijab-controversy-muslim-women-dignity-politics-debate-bihar-opnm1-dskc-2415310-2025-12-17,no,0,0,0,0,0,0,0,0,0,,no,0,0,0,0,0,0,0,0,0,
Aaj Tak,12/17/2025,https://www.aajtak.in/opinion-analysis-/story/nitish-kumar-seven-nischay-third-phase-focus-on-viksit-bihar-roadmap-opnm1-dskc-2414886-2025-12-17,no,0,0,0,0,0,0,0,0,0,,no,0,0,0,0,0,0,0,0,0,
Aaj Tak,12/17/2025,https://www.aajtak.in/india/maharashtra/story/maharashtra-mlc-pragya-satav-congress-set-to-join-bjp-marathwada-politics-ntcpbt-rpti-2414901-2025-12-17,yes,1,0,1,0,0,0,0,0,0,"1. Clickbait Bias- ""महाराष्ट्र में कांग्रेस को बड़ा झटका"", 2. Framing Bias- ""करारी हार""",yes,1,0,1,0,0,0,0,0,0,1. Framing bias
Aaj Tak,12/17/2025,https://www.aajtak.in/india/politics/story/before-apj-abdul-kalam-bjp-proposed-atal-bihari-vajpayee-for-president-book-reveal-ntc-dskc-2414855-2025-12-17,no,0,0,0,0,0,0,0,0,0,,no,0,0,0,0,0,0,0,0,0,
Aaj Tak,12/17/2025,https://www.aajtak.in/india/politics/story/nitin-nabin-meets-lk-advani-and-amit-shah-party-functionaries-workers-throng-office-ntc-rpti-2414642-2025-12-17,no,0,0,0,0,0,0,0,0,0,,no,0,0,0,0,0,0,0,0,0,
Aaj Tak,12/16/2025,https://www.aajtak.in/india/news/story/mgnrega-replaced-by-vb-g-ram-g-bill-2025-rural-employment-changes-ntcpmm-dskc-2414343-2025-12-16,no,0,0,0,0,0,0,0,0,0,,no,0,0,0,0,0,0,0,0,0,
Aaj Tak,12/16/2025,https://www.aajtak.in/opinion-analysis-/story/nitin-nabin-bjp-appointments-caste-politics-bihar-up-politics-opnm1-dskc-2414350-2025-12-16,no,0,0,0,0,0,0,0,0,0,,no,0,0,0,0,0,0,0,0,0,
Aaj Tak,12/16/2025,https://www.aajtak.in/opinion-analysis-/story/bmc-elections-2026-will-settle-the-question-of-thackeray-legacy-ubt-shinde-shivsena-raj-thackeray-opns2-dskc-2414297-2025-12-16,yes,0,0,0,1,0,0,0,0,0,"1. Linguistic Bias- ""जीवन-मरण का सवाल है"", "" बीएमसी, जो शिवसेना के लिए मां की तरह रही है, अब देखना है कि अपने बेटे के लिए कितना प्यार बरसाती है""",yes,0,0,0,1,0,0,0,0,0,"1. Linguistic Bias- ""जीवन-मरण का सवाल है"", "" बीएमसी, जो शिवसेना के लिए मां की तरह रही है, अब देखना है कि अपने बेटे के लिए कितना प्यार बरसाती है"""
Aaj Tak,12/16/2025,https://www.aajtak.in/india/chhattisgarh/story/former-cm-bhupesh-baghel-bjp-acting-national-president-nitin-nabin-congress-ntcpbt-rpti-2414218-2025-12-16,no,0,0,0,0,0,0,0,0,0,,no,0,0,0,0,0,0,0,0,0,
Aaj Tak,12/16/2025,https://www.aajtak.in/opinion-analysis-/story/now-bjp-has-real-high-command-of-modi-amit-shah-promoting-gully-boys-like-nitin-nabin-in-power-structure-leadership-decisions-opnm1-dskc-2413874-2025-12-16,yes,1,1,0,0,0,0,0,0,0,"1. Clickbait Bias- Choosing the term gully boy in the title, 2. Selection Bias- The article quotes biased opinions of a news anchor, towards the BJP and against Congress",yes,1,1,0,0,0,0,0,0,0,"1. Clickbait Bias- Choosing the term gully boy in the title, 2. Selection Bias- The article quotes biased opinions of a news anchor, towards the BJP and against Congress"
Aaj Tak,12/16/2025,https://www.aajtak.in/opinion-analysis-/story/1971-india-pakistan-war-victory-bangladesh-liberation-what-we-achieved-in-shimla-agreement-opns2-dskc-2413787-2025-12-16,no,0,0,0,0,0,0,0,0,0,,no,0,0,0,0,0,0,0,0,0,
Aaj Tak,12/16/2025,https://www.aajtak.in/india/politics/story/vbg-ram-g-bill-replace-mgnrega-scheme-congress-bjp-political-fight-name-change-ntcpkb-dskc-2413764-2025-12-16,yes,0,0,0,0,0,0,1,0,0,"1. Ommision Bias- The article focussed mainly on the name change issue of the program, but didnt emphaisize on the main issue of burden on the state governments due to this change.",yes,0,1,0,0,0,0,0,0,0,"1. Omission Bias- The article focussed mainly on the name change issue of the program, but didnt emphaisize on the main issue of burden on the state governments due to this change."
Aaj Tak,12/16/2025,https://www.aajtak.in/india/politics/story/congress-opens-front-against-bill-change-name-mnrega-ntc-rpti-2413665-2025-12-16,yes,0,0,0,0,0,0,1,0,0,"1. Ommision Bias- The article focussed mainly on the name change issue of the program, but didnt emphaisize on the main issue of burden on the state governments due to this change.",yes,0,1,0,0,0,0,0,0,0,"1. Omission Bias- The article focussed mainly on the name change issue of the program, but didnt emphaisize on the main issue of burden on the state governments due to this change."
Aaj Tak,12/15/2025,https://www.aajtak.in/opinion-analysis-/story/vb-g-ram-g-bill-replacing-mgnrega-rural-employment-act-what-will-change-opnm1-dskc-2413479-2025-12-15,no,0,0,0,0,0,0,0,0,0,,no,0,0,0,0,0,0,0,0,0,
Aaj Tak,12/15/2025,https://www.aajtak.in/madhya-pradesh/story/farmers-protest-on-dec-26-against-simhastha-land-pooling-policy-lcln-dskc-2413399-2025-12-15,yes,0,0,0,1,0,0,0,0,0,"1. Linguistic Bias- ""डेरा डालो, घेरा डालो""",yes,0,0,0,1,0,0,0,0,0,"1. Linguistic Bias- ""डेरा डालो, घेरा डालो"""
Aaj Tak,12/15/2025,https://www.aajtak.in/opinion-analysis-/story/why-bjp-appointed-national-working-president-role-process-explained-opnm1-dskc-2413078-2025-12-15,no,0,0,0,0,0,0,0,0,0,,no,0,0,0,0,0,0,0,0,0,
Aaj Tak,12/15/2025,https://www.aajtak.in/madhya-pradesh/story/after-remarks-on-ladli-behna-scheme-create-furore-mp-minister-vijay-shah-lcln-strc-2412970-2025-12-15,yes,0,1,1,0,0,0,1,0,0,"selection-मध्य प्रदेश सरकार में मंत्री विजय शाह अपनी विवादित टिप्पणी पर अब सफाई दे रहे हैं,framing-जिस पर राजनीतिक हंगामा मच गया था,omission-लेखक के पाठ में मंत्री के बयान का विस्तृत संदर्भ या स्पष्टीकरण का पूरा विवरण शामिल नहीं किया गया है",yes,0,0,1,0,0,0,0,0,0,"1.Framing bias-""जिस पर राजनीतिक हंगामा मच गया था"""
Aaj Tak,12/15/2025,https://www.aajtak.in/india/politics/story/congress-rahul-gandhi-buried-history-like-mughals-under-aurangzeb-says-bjp-ntc-rpti-2412933-2025-12-15,yes,0,1,1,0,0,1,1,0,0,"selection-बीजेपी ने दावा किया कि राहुल गांधी के नेतृत्व में कांग्रेस इतिहास के पन्नों में ठीक उसी तरह दफन हो जाएगी, जैसे मुगल साम्राज्य का पतन हुआ।,framing-political attack rather than neutrally reporting,stance-बीजेपी ने कांग्रेस पर मुस्लिम लीग-नक्सली एजेंडा पर काम करने का आरोप लगाया,omission-लेख में कांग्रेस या राहुल गांधी की स्पष्टीकरण",yes,0,1,0,0,1,1,0,0,0,"1. Selection Bias: The fact that congress is working only muslim league and naxal issue selectively without mentioning other work seems weighed on one side. 2. Ideology Bias, 3. Stance Bias: Emphasis is on giving analogy with historical figures and polarising readers."
Aaj Tak,12/14/2025,https://www.aajtak.in/india/politics/story/nitin-nabin-bjp-new-president-bihar-minister-political-signals-ntcpkb-dskc-2412789-2025-12-14,yes,0,1,1,0,0,0,0,0,0,"selection-बीजेपी ने नितिन नबीन को पार्टी का राष्ट्रीय कार्यकारी अध्यक्ष नियुक्त किया है,framing-बीजेपी के कार्यकारी अध्यक्ष नियुक्त किए गए नितिन नबीन की उम्र महज 45 साल है,पार्टी ने यह साफ कर दिया है कि उसका फोकस भविष्य की लीडरशिप पर है",no,0,0,0,0,0,0,0,0,0,
Aaj Tak,12/14/2025,https://www.aajtak.in/india/politics/story/bjp-new-national-leader-nitin-nabin-assets-education-cases-bihar-ntc-dskc-2412746-2025-12-14,no,0,0,0,0,0,0,0,0,0,,no,0,0,0,0,0,0,0,0,0,
Aaj Tak,12/13/2025,https://www.aajtak.in/india/politics/story/goa-panchayat-election-arvind-kejriwal-targest-congress-bjp-ntc-dskc-2412119-2025-12-13,yes,0,1,1,0,0,0,1,0,0,"selection-आम आदमी पार्टी के राष्ट्रीय संयोजक अरविंद केजरीवाल ने गोवा जिला पंचायत चुनाव के मद्देनजर शनिवार को कांग्रेस और भाजपा पर तीखा हमला बोला,framing-congress members join bjp after winning,omission-no content from bjp or congress(लेख में भाजपा या कांग्रेस की प्रतिक्रिया शामिल नहीं है; सिर्फ़ केजरीवाल के आरोपों पर प्रकाश डाला गया है)",yes,0,1,1,0,0,0,1,0,0,"1. Selection Bias,2. Omission Bias: Article is not balanced as it shows only the perpective of AAP. 3: Framing Bias- ""शनिवार को कांग्रेस और भाजपा पर तीखा हमला बोला"""
Aaj Tak,12/13/2025,https://www.aajtak.in/madhya-pradesh/story/congress-attacks-mohan-yadav-govt-two-years-of-failure-allegations-lcln-dskc-2411547-2025-12-13,yes,1,1,1,0,0,0,0,0,0,"selection-only on mohan yadav government no government response,framing-all about failures,and promises",yes,1,1,1,0,0,0,0,0,0,"1. Clickbait Bias- ""दो साल में सिर्फ नाकामी, कर्ज और खोखले दावे.""  2. Selection Bias- Focussing only on the failure of CM Yadav, does not show the other side. 3. Framing Bias- ""मध्य प्रदेश सरकार पर हमला बोलते हुए आरोप लगाया कि उसके दो साल के शासन में नाकामियां, जन-विरोधी नीतियां, आर्थिक कुप्रबंधन, बढ़ता कर्ज और खोखले दावे ही"""
Aaj Tak,12/13/2025,https://www.aajtak.in/india/politics/story/parliament-attack-anniversary-what-reasons-india-failed-to-take-revenge-opns2-dskc-2411483-2025-12-13,yes,0,1,1,0,0,0,0,0,0,"selection-india did not do anything after 2001 parliment attack(कई रक्षा विशेषज्ञों ने बताया कि भारत ने निर्णायक जवाब क्यों नहीं दिया ),framing-faile to take revange",no,0,0,0,0,0,0,0,0,0,
Aaj Tak,12/12/2025,https://www.aajtak.in/opinion-analysis-/story/cm-mohan-yadav-declares-madhya-pradesh-naxal-free-opnm1-dskc-2410902-2025-12-12,yes,0,1,1,0,0,1,0,0,0,"selection-Chief Minister Mohan Yadav’s leadership with out considering others,मुख्यमंत्री ने इसे अपनी सरकार की दो साल की सबसे बड़ी उपलब्धि बताया,stance-gave positive to the current ruling party",yes,0,1,0,0,0,1,0,0,0,1. Selection Bias- Selectively shows the efforts of the current chief minister to make MP naxalism-free. 2. Stance Bias- Information in favour of the ruling party only.
Aaj Tak,12/12/2025,https://www.aajtak.in/opinion-analysis-/story/karnataka-also-follows-yogi-path-how-bulldozer-became-hero-opns2-dskc-2410790-2025-12-12,no,0,0,0,0,0,0,0,0,0,,no,0,0,0,0,0,0,0,0,0,
Aaj Tak,12/11/2025,https://www.aajtak.in/opinion-analysis-/story/congress-power-sharing-disputes-karnataka-crisis-digvijay-sachin-pilot-opnm1-dskc-2410267-2025-12-11,yes,0,1,1,0,0,0,0,0,0,"selection-internal congress party disptures (कर्नाटक के राजनीतिक संकट की जड़),framing-घरेलू कलह ने पार्टी की कार्यप्रणाली और भी कमजोर बना दी है(there are internal wars than comparing with government)",yes,0,1,1,1,0,0,0,0,0,"1. Selection Bias- Power sharing is a general issue happened in many parties in general, but the article focusses on the internal problems of congress. 2. Framing Bias, 3. Linguistic Bias- ""सत्ता से हाथ धोना पड़ा था"", ""मौका देखकर निकल लिए"""
Aaj Tak,12/11/2025,https://www.aajtak.in/madhya-pradesh/story/bjp-mla-rameshwar-sharma-reacts-on-cong-mla-arif-masood-lcln-dskc-2410115-2025-12-11,yes,0,1,1,1,1,1,1,0,1,"selection-कांग्रेस विधायक आरिफ मसूद के वंदे मातरम् नहीं गाने के बयान पर बीजेपी विधायक रामेश्वर शर्मा ने तीखी प्रतिक्रिया दी है।,framing-refusing singing national anthem,lingustic-उन पर ‘जिन्ना की मानसिकता’ से काम करने का आरोप लगाया है,idealogy-भारत माता की जय बोलने के लिए तुम्हारा मजहब मना कर रहा है?,omission-why they did not sing the reason behind that..,emotional -used some emotinal word (बोलने के लिए तुम्हारा मजहब मना कर रहा है).",yes,0,1,0,0,0,0,1,0,1,1. Selection Bias- Selectively targetting Congress and muslim leaders. 2. Omission Bias- Not including their opinion on why not to stand for national song must be included for balance. 3. Emotional Bias- Specifically targetting emotional and religious sentiments of people.
Aaj Tak,12/11/2025,https://www.aajtak.in/opinion-analysis-/story/shashi-tharoor-savarkar-award-controversy-congress-bjp-opnm1-dskc-2409744-2025-12-11,yes,1,1,0,0,0,0,1,0,0,"omission-लेख में आयोजकों के दृष्टिकोण, स्वतंत्र विश्लेषकों की राय, या सावरकर की विरासत पर विस्तृत चर्चा शामिल नहीं है — वह केवल राजनीतिक संदेश पर केंद्रित है(did not give fully matter)",yes,1,0,0,0,0,0,1,0,0,"1. Clickbait Bias- ""वीर सावरकर अवॉर्ड ठुकराकर शशि थरूर कहना क्या चाहते हैं?"" 2. Omission Bias- Talking only about the political implications of rejecting the award."
Aaj Tak,12/10/2025,https://www.aajtak.in/india/politics/story/amit-shah-rahul-gandhi-lok-sabha-election-sir-congress-bjp-ntc-dskc-2409110-2025-12-10,yes,0,1,0,0,0,0,0,0,0,selection-only amit shas side no rahul gandhi side,yes,0,1,1,0,0,0,0,0,0,"1. Framing: ""लोकसभा में राहुल गांधी पर क्यों भड़के अमित शाह"" => framed as Amit Shah vs Rahul Gandhi with only focusing on their comments but not on the main reason of conflict which was SIR  2. Selection bias: points on SIR missing, only the conflict is highlighted, not the reason of the conflict"
Aaj Tak,12/10/2025,https://www.aajtak.in/opinion-analysis-/story/electoral-reforms-debate-in-parliament-akhilesh-yadav-and-manish-tiwari-demand-ballot-papers-opns2-dskc-2409072-2025-12-10,no,0,0,0,0,0,0,0,0,0,,no,0,0,0,0,0,0,0,0,0,
Aaj Tak,12/10/2025,https://www.aajtak.in/opinion-analysis-/story/vande-mataram-parliamentary-debate-mamata-banerjee-narendra-modi-opnm1-dskc-2409071-2025-12-10,yes,0,1,0,0,0,1,1,0,0,selection-अब बहस के बाद की राजनीति शुरू हो गई है ममता बनर्जी को संसद में वंदे मातरम् पर बहस के लिए समर्थन करना पड़ा और अब वही मौका उसे फायदा देने का साधन है omission-लेख में वंदे मातरम् पर बहस के ऐतिहासिक या सांस्कृतिक महत्त्व का संतुलित विवरण शामिल नहीं है — केवल राजनीतिक परिणामों पर ज़ोर है,yes,0,1,0,0,0,1,0,0,0,"1. Stance: Disapproval of one side is evident and the stance bias is clear.  2. Selection bias: conflict between Mamata Banerjee and Narendra Modi is highlighted regarding Vande Mataram as a political confrontation, but does not include points on why this debate matters  3. Framing: “ममता बनर्जी के बयान पर मोदी की प्रतिक्रिया"" => article framing is done to show the political fight rather than debate substance"
Aaj Tak,12/10/2025,https://www.aajtak.in/opinion-analysis-/story/nitish-kumar-jdu-nishant-political-entry-challenge-for-jdu-bihar-opnm1-dskc-2408832-2025-12-10,yes,0,1,1,0,0,1,0,0,0,"selection-निशांत कुमार के राजनीति में आने की चर्चा बार-बार गर्म होती रही है  लेकिन अंतिम निर्णय उनके और नीतीश कुमार पर ही होगा,stance-considered as real",yes,0,0,1,1,0,0,0,0,0,"1. Linguistic: “जदयू में भूचाल?”  2. Framing: “नीतीश कुमार के बेटे निशांत की राजनीति में एंट्री जदयू के लिए चुनौती बन सकती है”, “बिहार की राजनीति में यह एक बड़ा सवाल बनता जा रहा है” =>framed as a challenge, not a neutral reporting  "
Aaj Tak,12/9/2025,https://www.aajtak.in/opinion-analysis-/story/why-priyanka-gandhi-akhilesh-yadav-supporting-dmk-to-impeach-madras-high-court-judge-for-lord-muruga-and-avulia-dargah-controversy-verdict-opns2-dskc-2408269-2025-12-09,yes,1,1,1,0,0,1,0,0,0,"stance-लेख में न्यायपालिका की स्वतंत्रता, महाभियोग की कानूनी औचित्य, या विशेषज्ञ विश्लेषण पर व्यापक संदर्भ शामिल नहीं है",yes,1,0,1,1,0,0,0,0,0,"1. Framing: “यह सवाल भारत की लोकतांत्रिक व्यवस्था की नींव को हिला देता है.”, “विपक्ष का कदम चुनावी स्टंट लगता है” => frames the article as a broad democratic threat  2. Linguistic: “लोकतंत्र की मृत्यु की घंटी बजाने जैसा” "
Aaj Tak,12/9/2025,https://www.aajtak.in/india/politics/story/when-you-win-evms-are-fine-but-when-you-lose-they-are-tampered-says-bjp-allies-to-opposition-lclnt-dskc-2408254-2025-12-09,yes,0,1,1,0,0,0,1,0,0,"selection-लोकसभा में ‘चुनाव सुधार’ पर चर्चा के दौरान… तेलुगू देशम पार्टी (TDP) और जनता दल (यूनाइटेड) (JDU) ने विपक्ष ,framing-EVM criticism in Parliament ,omission-EVM integrity, Supreme Court",yes,0,1,1,0,0,1,0,0,0,"1. Framing: “जीतने पर ईवीएम सही, हारने पर छेड़छाड़?” => framed as a hypocrisy of the opposition  2. Selection: does not include opposition's detailed reasoning, while BJP's allies statements are highlighted  3. Stance bias is seen as the narrative aligns with BJP's allies comments and disapproves the opposition"
Aaj Tak,12/9/2025,https://www.aajtak.in/opinion-analysis-/story/babri-masjid-controversy-now-stuck-to-mamata-banerjee-not-humayun-kabir-in-west-bengal-election-opnm1-dskc-2407934-2025-12-09,yes,0,1,1,0,0,0,0,0,0,"selection-political fallout of the Babri Masjid,framing-disadvantage for Mamata Banerjee,(अब बाबरी मस्जिद विवाद ममता बनर्जी के गले फँसा दिया गया है)",yes,0,0,1,1,0,0,1,0,0,"1. Framing: “हुमायूं कबीर के मामले में ममता बनर्जी ने जो एक्शन लिया, बीजेपी की बोलती बंद हो जानी चाहिए थी. बीजेपी तो हद से ज्यादा हमलावर हो गई है.” => frames the story as a political attack on Mamata Banerjee, suggesting she should have silenced critics but instead faces criticism from both BJP and Congress.  2. Linguistic: ""बवाल बढ़ता ही जा रहा है.”  3. Omission: Presents a highly charged critique of Mamata’s politics as fact (without counterbalance)."
Aaj Tak,12/9/2025,https://www.aajtak.in/india/politics/story/sonia-gandhi-rouse-avenue-court-issues-notics-1980-voter-list-controversy-ntcpkb-rpti-2407885-2025-12-09,yes,0,1,1,0,0,0,1,0,0,"Selection-दिल्ली की राउज एवेन्यू कोर्ट ने कांग्रेस की पूर्व अध्यक्ष और राज्यसभा सांसद सोनिया गांधी को… 1980 में वोटर लिस्ट में नाम जुड़वाने के आरोप में नोटिस जारी किया,omission-no explanation",yes,0,1,0,0,0,0,1,0,0,"1. Selection: does not include detailed legal context of the notices (charges, process, timeframe) or voices from Sonia Gandhi’s side explaining timeline or intent, Omission bias present too"
Aaj Tak,12/9/2025,https://www.aajtak.in/opinion-analysis-/story/vande-mataram-parliament-debate-modi-mamata-congress-akhilesh-priyanka-opnm1-dskc-2407247-2025-12-09,yes,0,0,1,1,0,0,0,0,0,"""कांग्रेस को कठघरे में खड़ा किया”,“घेरना” ,""तेवर”,“तुष्टीकरण की राजनीति” =>presents the Vande Mataram issue like political fight, focusing on who attacked whom, instead of explaining what was actually debated in Parliament.",yes,0,0,1,1,0,0,0,0,0,"1. Framing: ""तो क्या मोदी कांग्रेस के साथ साथ तृणमूल कांग्रेस को भी टार्गेट किया है?"" the Vande Mataram discussion is presented as a target and clash between national leaders  2. Linguistic: ""तल्ख तेवर"""
Aaj Tak,12/8/2025,https://www.aajtak.in/opinion-analysis-/story/aviation-minister-ram-mohan-naidu-on-indigo-crisis-air-passengers-disagree-opns2-dskc-2407355-2025-12-08,yes,0,1,1,1,0,1,1,0,0,"“यात्री नाराज़”, “इंडिगो संकट”, “लोगों को भरोसा नहीं”, “जमीनी हकीकत अलग” => questions Aviation Minister’s explanation of the IndiGo crisis and gives more space to passenger anger, making it feel critical rather than neutral.",yes,0,1,1,1,0,1,1,0,0,framing bias “इंडिगो संकट पर एविएशन मंत्री की सफाई ने खड़े कर दिए कई और सवाल…”  Linguistic Bias   “…इंडिगो की मनमानी पर DGCA को कदम पीछे खींचना पड़ा…
Aaj Tak,12/8/2025,https://www.aajtak.in/opinion-analysis-/story/dhurandhar-movie-review-islamophobia-propaganda-and-criticism-of-aditya-dhar-gangs-of-lyari-opns2-dskc-2406769-2025-12-08,yes,0,1,1,1,1,1,1,0,0,"“इस्लामोफोबिया”, “गैंग्स ऑफ़ लियारी जैसा”, push the review to political or social narrative rather than just critiquing film craft.",yes,0,1,1,1,1,1,1,1,0,"Selection Bias   Article highlights critics saying the film is propaganda and lacks comprehensive opposing or supporting perspectives.    Framing Bias “धुरंधर मूवी पर बड़ी बहस…” — Sets the article around controversy.   Linguistic Bias   Uses charged terms like “Islamophobia” and “propaganda.”
ideology Bias  Positions the film within ideological culture wars, not just cinema."
Aaj Tak,12/8/2025,https://www.aajtak.in/opinion-analysis-/story/vande-mataram-parliament-debate-bjp-challenge-to-tmc-mamata-banerjee-bengal-election-opnm1-dskc-2406752-2025-12-08,yes,0,1,1,0,0,0,0,0,0,"“बीजेपी के लिए बेहतरीन अवसर”, “ममता के लिए आपदा जैसा” frames political issue that helps BJP in Bengal election and creates difficulties for Mamata Banerjee",yes,0,1,1,0,0,0,0,0,0,"Framing Bias: The issue is presented as BJP’s political gain and Mamata Banerjee’s loss, turning a debate into an election-centric narrative."
Aaj Tak,12/8/2025,https://www.aajtak.in/madhya-pradesh/story/dharmendra-pradhan-statement-on-mp-children-nutrition-cong-slams-mohan-yadav-lcln-dskc-2406701-2025-12-08,no,,,,,,,,,,,no,,,,,,,,,,
Aaj Tak,12/8/2025,https://www.aajtak.in/india/politics/story/vande-mataram-150th-anniversary-parliamentary-debate-muslim-clerics-oppose-islam-pm-modi-ntcpkb-dskc-2406590-2025-12-08,yes,0,0,1,0,0,0,0,0,0,"“मुसलमान... गाने से साफ इनकार”, “इस्लामी सिद्धांतों के खिलाफ” =>framing it as controversial issue about religion and identity rather than reporting the debate.",yes,0,0,1,0,0,0,0,0,0,"The article presents the issue as a religious identity conflict, not just a legislative or political discussion."
Aaj Tak,12/6/2025,https://www.aajtak.in/opinion-analysis-/story/tribal-hinduism-sarna-code-reservation-and-congresss-demand-opns2-dskc-2405406-2025-12-06,yes,0,1,1,1,1,1,1,0,1,"“राजनीतिक आग लगा दी”, “देश की एकता-अखंडता के खिलाफ”,“साजिश”  =>push readers to view it as a political strategy/conflict rather than cultural and census issues.",yes,0,1,1,1,1,1,1,1,1,"Selection Bias  “कुछ नेताओं ने Sarna कोड को हिंदू धर्म से जोड़ने की कोशिश की…”  Focuses on specific political quotes while omitting broader tribal voices.    Framing Bias  “धर्म और reservation जैसे मुद्दों को चुनावी हथियार के रूप में…” Frames the issue as political strategy, not cultural rights.
Linguistic Bias   यह मुद्दा जनता को बांटने वाला…”Uses evaluative language that influences interpretation.      Ideology Bias   कांग्रेस ने इसे हिंदू मत को टारगेट…” Aligns story with one political ideology.Stance Bias  “लेखक ने संकेत दिया… राजनीतिक रणनीति…”  Article tone supports a political interpretation.Omission Bias Does not include tribal leaders’ perspectives or expert/legal context.Fact Bias  “यह स्पष्ट है कि राजनीतिक लाभ के लिए…”  Presents interpretive assertion as fact.   Emotional Bias  “ऐसा मुद्दा जो सामाजिक ताने-बाने को प्रभावित…”  Evokes emotional concern about society."
Aaj Tak,12/6/2025,https://www.aajtak.in/india/news/story/sonia-gandhi-attacks-ideology-that-glorifies-mahatma-gandhi-killers-ntc-dskc-2405151-2025-12-06,yes,0,0,1,1,1,0,0,0,1,"“महात्मा गांधी के कातिलों का महिमामंडन”, “सीधा हमला बोला”, “संविधान के खिलाफ काम” ,“विचारधारा जो नफरत बढ़ाती है” =>focus on strong accusations of ideology and history-distortion, not just neutral quotes.",yes,0,0,1,1,1,0,0,0,1,"Selection Bias “वही सोच आज सत्ता प्रतिष्ठानों तक पहुंच चुकी है, जिसके कारण महात्मा गांधी की हत्या हुई थी…”  Highlights only critical political quotes without responses from the accused.Framing Bias “महात्मा गांधी के हत्यारों का महिमामंडन हो रहा है…”  Frames the narrative around ideological threat and glorification of killers.
Linguistic Bias “इतिहास को फिर से लिखने और संस्थाओं को कमजोर करने की कोशिश…”  Uses strong, charged phrasing. Emotional Bia s“देश की आत्मा को बचाने का समय है…” Designed to evoke emotional response."
Aaj Tak,12/5/2025,https://www.aajtak.in/india/politics/story/indigo-flights-cancelled-ceo-pieter-elbers-fdtl-ntc-dskc-2404865-2025-12-05,no,0,0,0,0,0,0,0,0,0,,no,0,0,0,0,0,0,0,0,0,
Aaj Tak,12/5/2025,https://www.aajtak.in/madhya-pradesh/story/mp-assembly-question-hour-skipped-by-mlas-due-to-wedding-season-lcln-dskc-2404854-2025-12-05,no,0,0,0,0,0,0,0,0,0,,no,0,0,0,0,0,0,0,0,0,
Aaj Tak,12/5/2025,https://www.aajtak.in/opinion-analysis-/story/rss-strategy-for-bjp-up-election-based-on-bihar-success-model-opnm1-dskc-2404537-2025-12-05,no,0,0,0,0,0,0,0,0,0,,no,0,0,0,0,0,0,0,0,0,
Aaj Tak,12/5/2025,https://www.aajtak.in/india/politics/story/president-putin-at-rajghat-visitors-book-tribute-to-mahatma-gandhi-message-ntcppl-rpti-2404420-2025-12-05,no,0,0,0,0,0,0,0,0,0,,no,0,0,0,0,0,0,0,0,0,
Aaj Tak,12/4/2025,https://www.aajtak.in/opinion-analysis-/story/who-will-bjp-president-keshav-prasad-bhupendra-yadav-dharmendra-pradhan-opns2-dskc-2403790-2025-12-04,yes,0,1,1,1,0,0,1,0,0,"“किसका पलड़ा भारी?, “प्रबल दावेदार”, “संकेत मिल रहे हैं” =>who might become the next BJP president by comparing possible leaders like Keshav Prasad, Bhupendra Yadav and Dharmendra Pradhan",yes,0,1,1,1,1,1,1,0,0,"Selection Bias  “के अध्यक्ष पद के लिए जिन नामों की चर्चा हो रही है…”  “Among the names being discussed for the president post…” .Framing Bias “राजनीतिक सरगर्मियों से लग रहा है कि…” “From political activities it seems that…” Linguistic Bias “क्या कोई वाइल्ड कार्ड एंट्री होने वाली है?”  “Is there going to be a ‘wild card entry’?” (uses dramatic, non-neutral phrasing)."
Aaj Tak,12/4/2025,https://www.aajtak.in/opinion-analysis-/story/bengal-humayun-kabir-babri-masjid-campaign-mamata-banerjee-politics-opnm1-dskc-2403774-2025-12-04,yes,0,0,1,1,0,0,0,0,0,"“बागी रुख”, “सांप्रदायिकता फैलाने”, “क्या ममता बनर्जी को डर है?” =>frames Humayun Kabir’s Babri Masjid announcement as a political threat to Mamata Banerjee’s leadership",yes,0,0,1,1,0,0,0,0,1,Emotional Bias — “क्या ममता बनर्जी को…चिंता सताने लगी है?” brings voter fear and political insecurity. Linguistic Bias “बागी रुख…”  Uses charged terminology that influences people.
Aaj Tak,12/4/2025,https://www.aajtak.in/india/politics/story/rahul-gandhi-accuses-opposition-meetings-with-foreign-delegations-bjp-ntcpmm-rpti-2403631-2025-12-04,no,0,0,0,0,0,0,0,0,0,,no,0,0,0,0,0,0,0,0,0,
Aaj Tak,12/4/2025,https://www.aajtak.in/opinion-analysis-/story/west-bengal-sir-dispute-modi-mamata-bjp-election-strategy-opnm1-dskc-2403466-2025-12-04,yes,0,0,1,1,0,0,0,0,0,"“राजनीतिक हथकंडे"", “कांग्रेस और कट्टरपंथी”, “रणनीति का हिस्सा?” =>interprets the West Bengal voter list SIR dispute as part of BJP’s political strategy against Mamata Banerjee",yes,0,0,1,1,0,1,1,0,1,
Aaj Tak,12/4/2025,https://www.aajtak.in/madhya-pradesh/story/congress-mlas-dressed-as-monkeys-staged-a-protest-in-mp-assembly-lcln-dskc-2403411-2025-12-04,no,0,0,0,0,0,0,0,0,0,,no,0,0,0,0,0,0,0,0,0,
Aaj Tak,12/4/2025,https://www.aajtak.in/india/politics/story/russia-president-putin-india-visit-indo-russia-friendship-1971-war-ntcppl-dskc-2403180-2025-12-04,no,0,0,0,0,0,0,0,0,0,,no,0,0,0,0,0,0,0,0,0,
Aaj Tak,12/3/2025,https://www.aajtak.in/opinion-analysis-/story/modi-chaiwala-ai-video-controversy-congress-ragini-nayak-personal-attacks-record-opnm1-dskc-2402756-2025-12-03,yes,0,0,1,1,0,0,0,0,0,"“निजी हमलों”, “कांग्रेस को हमेशा भारी पड़े हैं”, “कांग्रेस को नुकसान” =>interpret incident as pattern of personal targeting and political mistake",yes,0,0,1,1,0,1,0,0,0,"Framing Bias:   By linking the incident to past outcomes, the article frames it as yet another personal attack that has consistently hurt Congress, rather than assessing the event on its own merits."
Aaj Tak,12/3/2025,https://www.aajtak.in/opinion-analysis-/story/mcd-bypoll-results-delhi-people-message-for-aap-saurabh-bharadwaj-arvind-kejriwal-opnm1-dskc-2402450-2025-12-03,yes,0,1,1,1,0,0,1,0,0,"“सबक सीखना होगा”, “नकारात्मक संकेत”,“आलोचना और सवाल” =>interpret election outcome as  lesson and message rather than reporting bypoll results.",yes,0,1,1,1,0,0,1,0,0,"Framing Bias   ये सिर्फ MCD के नतीजे नहीं, संदेश है…”  Frames results as a broader political message.     Linguistic Bias  “AAP को करारा झटका…” Uses strong evaluative wording."
Aaj Tak,12/2/2025,https://www.aajtak.in/opinion-analysis-/story/akhilesh-yadav-sir-up-bihar-election-results-samajwadi-party-opnm1-dskc-2401736-2025-12-02,yes,0,1,1,1,0,0,1,0,0,"“जो सबक सीखा जाना चाहिए”, =>interpret election outcomes and political moves as strategic lessons and messages, not just reporting the facts.",yes,0,1,1,1,0,1,1,0,1,"Selection Bias “अखिलेश यादव के नेतृत्व और रणनीति को चुनाव परिणामों में अहम बताया गया…” Focuses on leadership interpretation while omitting grassroots voter views or other causes.  Framing Bias  “ये परिणाम सिर्फ आंकड़ों से ज्यादा राजनीति की कहानी कहते हैं…”  Frames the results as a political narrative rather than neutral reporting.Linguistic Bias   एक रणनीतिक मोड़…”   Stance Bias “लेखक मानते हैं कि यह सिर्फ हार-जीत नहीं…” Reflects author’s own position or interpretation.  Omission Bias   Omits voter voices, opposition perspective, and economic  context.Emotional Bias  “यह जीत-हार से ऊपर की भावना है…” Uses emotional sentiment in framing."
Aaj Tak,12/2/2025,https://www.aajtak.in/opinion-analysis-/story/vande-mataram-and-sanchar-sathi-issues-can-change-direction-of-the-winter-session-opns2-dskc-2401525-2025-12-02,no,0,0,0,0,0,0,0,0,0,,no,0,0,0,0,0,0,0,0,0,
Live Hindustan,2024-01-11 0:35:10,https://www.livehindustan.com/uttar-pradesh/bulandsehar/story-bku-apolitical-took-out-a-torch-procession-9184937.html,no,0,0,0,0,0,0,0,0,0,-,no,0,0,0,0,0,0,0,0,0,
Live Hindustan,2024-01-11 1:00:07,https://www.livehindustan.com/ncr/new-delhi/story-boycotting-ceremony-on-political-grounds-is-disrespect-to-god-nss-9185078.html,yes,0,0,1,0,1,0,0,0,1,"1. Ideology bias => The text promotes a religious-nationalist viewpoint, portraying participation in the ceremony as a duty and labeling dissent as self-interest or political gain. 2. Framing bias => The issue is framed as आस्था बनाम राजनीति. Terms like “भगवान के प्रति अनादर” and “प्रत्येक आस्तिक का कर्तव्य” push a moral–religious frame, steering readers toward one interpretation.",yes,0,0,1,0,1,0,0,0,0,"1. Ideology bias => The text promotes a religious-nationalist viewpoint, portraying participation in the ceremony as a duty and labeling dissent as self-interest or political gain. 2. Framing bias => The issue is framed as आस्था बनाम राजनीति. Terms like “भगवान के प्रति अनादर” and “प्रत्येक आस्तिक का कर्तव्य” push a moral–religious frame, steering readers toward one interpretation."
Live Hindustan,2024-01-11 1:30:56,https://www.livehindustan.com/bihar/muzaffarpur/story-doubt-on-zip-president-vice-president-continues-political-temperature-rises-9185395.html,no,0,0,0,0,0,0,0,0,0,,no,0,0,0,0,0,0,0,0,0,
Live Hindustan,2024-01-11 2:00:22,https://www.livehindustan.com/jharkhand/dhanbad/story-political-master-stroke-of-bjp-on-the-pretext-of-dhanbad-chandrapura-passenger-9185549.html,yes,1,0,0,0,0,0,0,0,0,1. Clickbait bias => धनबाद–चंद्रपुरा पैसेंजर के बहाने भाजपा का सियासी मास्टर स्ट्रोक,yes,1,0,0,0,0,0,0,0,0,1. Clickbait bias => धनबाद–चंद्रपुरा पैसेंजर के बहाने भाजपा का सियासी मास्टर स्ट्रोक
Live Hindustan,2024-01-11 8:29:03,https://www.livehindustan.com/uttar-pradesh/story-poor-anti-hindu-politics-of-congress-and-akhilesh-bjp-attack-on-rejecting-the-invitation-for-ram-mandir-pran-pratistha-9185830.html,no,0,0,0,0,0,0,0,0,0,-,yes,1,1,1,1,0,1,1,0,1,
Live Hindustan,2024-01-11 10:26:22,https://www.livehindustan.com/rajasthan/story-sachin-pilot-gave-vent-to-factionalism-in-bjp-understand-the-political-meaning-of-praising-kirodilal-meena-9185898.html,yes,0,0,0,0,0,1,0,0,1,"तो उम्मीद थी कि उन्हें सरकार में कोई बड़ी जिम्मेदारी दी जाएगी लेकिन ऐसा नहीं हुआ है, बहुत ही छोटा विभाग दिया गया है। जो मेहनत उन्होंने विपक्ष में रहते की थी उसका फल उन्हें नहीं मिल पाया।""""पर हम लोग आते जाते रहते हैं, यह धार्मिक मामला है इस पर राजनीति करना गलत है। सब की आस्था भगवान राम में है लेकिन बीजेपी धार्मिक आस्था के जरिए चुनावी लाभ लेना चाहती है जो सही नहीं है।""",no,0,0,0,0,0,0,0,0,0,
Live Hindustan,2024-01-11 15:58:40,https://www.livehindustan.com/chhattisgarh/story-how-will-chhattisgarh-shri-ramlala-darshan-yojana-affect-the-lok-sabha-elections-what-is-the-political-meaning-of-the-yatra-9186474.html,yes,0,0,1,1,1,1,0,0,1,"जानकारों की माने तो इस यात्रा से भाजपा को छत्तीसगढ़ के लोकसभा चुनाव में जरूर फायदा मिलेगा।  ""होनी है उसी साल देश में आम चुनाव भी होने हैं। लगातार देश में विपक्षी दल सत्ताधारी भाजपा के ऊपर राम मंदिर पर राजनीति करने का आरोप लगा रही है। छत्तीसगढ़ में भी प्रदेश की भाजपा सरकार श्री""",yes,0,0,0,0,0,1,0,0,0,
Live Hindustan,2024-01-11 16:45:27,https://www.livehindustan.com/jharkhand/bokaro/story-assistant-electoral-registration-officer-bermo-held-a-meeting-with-political-parties-9186694.html,no,0,0,0,0,0,0,0,0,0,,no,0,0,0,0,0,0,0,0,0,
Live Hindustan,2024-01-11 19:08:42,https://www.livehindustan.com/bihar/story-ex-cm-jitan-manjhi-claims-nitish-kumar-to-give-big-jolt-to-lalu-yadav-political-earthquake-expected-in-bihar-after-kharmas-9187472.html,yes,1,1,1,1,0,1,1,0,0,"1. Clickbait bias => खरमास के बाद बिहार में आएगा सियासी भूचाल? जीतन मांझी का दावा—नीतीश कुमार लालू को देंगे झटका। 2. Selection bias => Only opposition leaders’ views are presented; no BJP or neutral institutional response. 3. Framing bias => Events are framed to suggest opportunism, pressure politics, and instability around Nitish Kumar. 4. Linguistic bias => Phrases like “पलटी मारेंगे”, “दबाव”, “फिर वही स्थितियां” 5. Stance bias => The narrative consistently aligns with opposition criticism of Nitish Kumar and BJP. 6. Omission bias => Missing responses from Nitish Kumar, BJP, or official sources; no factual rebuttal.",yes,1,1,1,1,0,1,1,0,0,"1. Clickbait bias => खरमास के बाद बिहार में आएगा सियासी भूचाल? जीतन मांझी का दावा—नीतीश कुमार लालू को देंगे झटका। 2. Selection bias => Only opposition leaders’ views are presented; no BJP or neutral institutional response. 3. Framing bias => Events are framed to suggest opportunism, pressure politics, and instability around Nitish Kumar. 4. Linguistic bias => Phrases like “पलटी मारेंगे”, “दबाव”, “फिर वही स्थितियां” 5. Stance bias => The narrative consistently aligns with opposition criticism of Nitish Kumar and BJP. 6. Omission bias => Missing responses from Nitish Kumar, BJP, or official sources; no factual rebuttal."
Live Hindustan,2024-01-11 19:15:07,https://www.livehindustan.com/jharkhand/ranchi/story-party-should-give-political-participation-according-to-population-majlis-olema-9187568.html,no,0,0,0,0,0,0,0,0,0,,no,0,0,0,0,0,0,0,0,0,
Live Hindustan,2024-01-11 19:40:07,https://www.livehindustan.com/uttar-pradesh/muzaffar-nagar/story-kranti-sena-39-s-support-to-bku-apolitical-strike-9187681.html,no,0,0,0,0,0,0,0,0,0,,no,0,0,0,0,0,0,0,0,0,
Live Hindustan,2024-01-11 20:30:21,https://www.livehindustan.com/bihar/begusarai/story-good-people-stayed-away-from-politics-due-to-fear-of-money-muscle-power-or-caste-influence-9187944.html,yes,0,0,1,0,0,0,0,0,0,"""जिस लोकतंत्र में समाज के अच्छे लोग भागीदार नहीं बनते हैं, वहां लोगों को इस बात के लिए तैयार रहना चाहिए कि समाज का कोई मूर्ख आदमी राजा बनकर शासन करेगा।""",yes,0,0,1,0,0,0,0,0,1,"1. Emotional bias => Packaging of story creates fear and anger in population, as well as the choice of phrases => 2. Framing bias => ""मूर्खों, चोरों और बदमाशों का अड्डा"", ""मूूर्ख"" etc."
Live Hindustan,2024-01-11 21:30:09,https://www.livehindustan.com/jharkhand/ranchi/story-discussion-between-mir-and-cm-on-the-political-situation-of-the-state-9188237.html,no,0,0,0,0,0,0,0,0,0,,no,0,0,0,0,0,0,0,0,0,
Live Hindustan,2024-01-11 22:15:14,https://www.livehindustan.com/jharkhand/ranchi/story-shri-ram-temple-should-not-become-the-center-of-politics-anand-9188482.html,no,0,0,0,0,0,0,0,0,0,,no,0,0,0,0,0,0,0,0,0,
Live Hindustan,2024-01-11 22:16:36,https://www.livehindustan.com/blog/story-hindustan-opinion-column-12-january-2024-maharashtra-at-new-stage-of-politics-9188450.html,yes,0,0,1,0,0,1,0,0,0,“उद्धव ठाकरे को झटका लगा है और अब देखना होगा कि राज्य की राजनीति पर इसका कितना असर होगा।” “भाजपा के साथ उनके गठबंधन ने ही यह स्थिति पैदा की है।”,yes,0,0,1,0,0,1,0,0,0,"1. Stance bias, Framing bias => ""उद्धव ठाकरे भावनात्मक अपील करके ही अपनी राजनीति करते रहे हैं"", ""उद्धव ठाकरे और शरद पवार के कंधों का ही इस्तेमाल करती रहेगी"""
Live Hindustan,2024-01-12 0:15:38,https://www.livehindustan.com/uttar-pradesh/jaunpur/story-bjp-does-politics-of-misleading-toofani-saroj-9189445.html,yes,1,1,1,0,0,0,0,0,0,"1. Framing bias => Provocative statements of the MLA are reported and given more coverage. 2. Selection bias => No views of opposition party are reflected, made more sure by the headline.",yes,0,1,1,0,0,0,0,0,0,"1. Framing bias => Provocative statements of the MLA are reported and given more coverage. 2. Selection bias => No views of opposition party are reflected, made more sure by the headline."
Live Hindustan,2024-01-12 0:30:36,https://www.livehindustan.com/bihar/araria/story-the-political-temperature-in-the-block-has-risen-as-soon-as-the-no-confidence-motion-was-filed-9189581.html,no,0,0,0,0,0,0,0,0,0,,no,0,0,0,0,0,0,0,0,0,
Live Hindustan,2024-01-12 13:11:34,https://www.livehindustan.com/chhattisgarh/story-political-rhetoric-intensifies-in-chhattisgarh-on-ram-mandir-issue-ts-singhdev-said-on-sonia-statement-on-pran-pratistha-9190709.html,no,0,0,0,0,0,0,0,0,0,,no,0,0,0,0,0,0,0,0,0,
Live Hindustan,2024-01-12 17:45:25,https://www.livehindustan.com/jharkhand/latehar/story-political-discussion-cum-forest-feast-program-of-tailik-sahu-samaj-concluded-in-balumath-9191639.html,no,0,0,0,0,0,0,0,0,0,,no,0,0,0,0,0,0,0,0,0,
Live Hindustan,2024-01-12 19:24:10,https://www.livehindustan.com/bihar/story-bjym-president-tejasvi-surya-says-bihar-lost-enough-due-to-caste-politics-lalu-not-looking-beyond-son-tejashwi-in-rjd-9192093.html,yes,0,1,1,0,0,0,0,0,0,"1. Selection bias => The article reports only BJP/Yuva Morcha leaders’ statements. No opposing voices, experts, or neutral analysis are included. 2. Framing bias => Issues like caste politics, education failure, and youth migration are framed to support BJP’s narrative and blame rival parties. 3.  Stance bias => The story consistently endorses BJP’s viewpoint, presenting claims as persuasive arguments rather than contested opinions.",yes,0,1,1,0,0,1,0,0,0,"1. Selection bias => The article reports only BJP/Yuva Morcha leaders’ statements. No opposing voices, experts, or neutral analysis are included. 2. Framing bias => Issues like caste politics, education failure, and youth migration are framed to support BJP’s narrative and blame rival parties. 3.  Stance bias => The story consistently endorses BJP’s viewpoint, presenting claims as persuasive arguments rather than contested opinions."
Live Hindustan,2024-01-12 22:15:05,https://www.livehindustan.com/ncr/new-delhi/story-there-will-be-political-earthquake-in-maharashtra-after-lok-sabha-elections-shinde-9193108.html,yes,1,0,1,0,0,0,0,0,0,,no,1,0,0,0,0,0,0,0,0,
Live Hindustan,2024-01-12 23:45:33,https://www.livehindustan.com/bihar/motihari/story-politics-heats-up-over-no-confidence-motion-in-dhaka-9193676.html,no,0,0,0,0,0,0,0,0,0,,no,0,0,0,0,0,0,0,0,0,
Live Hindustan,2024-02-11 19:20:05,https://www.livehindustan.com/uttar-pradesh/agra/story-it-is-important-to-learn-the-political-values-of-pandit-deendayal-9312268.html,no,0,0,0,0,0,0,0,0,0,,no,0,0,0,0,0,0,0,0,0,
Live Hindustan,2024-02-11 21:00:26,https://www.livehindustan.com/jharkhand/bokaro/story-pandit-deendayal-gave-new-ideology-to-indian-politics-parinda-9312711.html,no,0,0,0,0,0,0,0,0,0,,no,0,0,0,0,0,0,0,0,0,
Live Hindustan,2024-02-11 21:45:13,https://www.livehindustan.com/uttarakhand/champawat/story-opposition-cheated-the-state-by-doing-appeasement-politics-cm-9312808.html,yes,1,1,1,0,0,1,0,0,0,“तुष्टीकरण की राजनीति कर विपक्ष ने प्रदेश को ठगा: सीएम”,yes,1,1,1,0,0,1,0,0,0,"1. “तुष्टीकरण की राजनीति कर विपक्ष ने प्रदेश को ठगा: सीएम”  => Clickbait bias, 2. Framing bias =>  Article frames the BJP government as reform-oriented, people-centric, and effective, the opposition as obstructive, regressive, and responsible for underdevelopment. 3. Stance bias, Selection bias => No views of opposition parties presented, narrative only around BJP spokesperson"
Live Hindustan,2024-02-11 22:20:07,https://www.livehindustan.com/uttar-pradesh/balrampur/story-bjp-government-is-doing-politics-of-votes-and-appeasement-mohd-ayub-9312922.html,yes,1,0,1,0,0,1,0,0,1,"1. Mild emotional bias after just reporting statements of Peace Party, and mentions of targetted groups 2. Selection, Stance bias => Only statements from one political side (PIS Party leaders) are included. No response or perspective from the BJP/government is given. 3. Framing bias => Events are framed primarily as oppression, fear, and injustice caused by the ruling government, guiding the reader toward a negative interpretation. 4. Clickbait bias => “भाजपा की सरकार वोट एवं ध्रुवीकरण की कर रही राजनीति: मो. अयूब”",yes,1,0,1,0,0,1,0,0,1,"1. Mild emotional bias after just reporting statements of Peace Party, and mentions of targetted groups 2. Selection, Stance bias => Only statements from one political side (PIS Party leaders) are included. No response or perspective from the BJP/government is given. 3. Framing bias => Events are framed primarily as oppression, fear, and injustice caused by the ruling government, guiding the reader toward a negative interpretation."
Live Hindustan,2024-02-11 22:45:05,https://www.livehindustan.com/ncr/new-delhi/story-nadda-accused-india-alliance-of-dynastic-politics-9312990.html,yes,0,1,1,0,0,1,0,0,0,,yes,0,1,1,0,0,1,0,0,0,"1. Selection bias => Only BJP voices and accusations are reported. 2. Stance bias => The article clearly aligns with BJP’s viewpoint. BJP leaders’ claims are presented extensively and positively, while opponents are criticized. 3. Framing bias => Reporting words like “वंशवादी राजनीति,” “भ्रष्टाचार,” “बहुत खराब शासन” creates a negative interpretive frame for non-BJP parties."
Live Hindustan,2024-02-11 23:30:22,https://www.livehindustan.com/uttar-pradesh/agra/story-it-is-important-to-learn-the-political-values-of-pt-deendayal-9313361.html,no,0,0,0,0,0,0,0,0,0,,no,0,0,0,0,0,0,0,0,0,
Live Hindustan,2024-02-11 23:45:15,https://www.livehindustan.com/bihar/biharsharif/story-many-proposals-were-taken-in-the-meeting-of-political-parties-9313534.html,no,0,0,0,0,0,0,0,0,0,,no,0,0,0,0,0,0,0,0,0,
Live Hindustan,2024-02-12 0:00:22,https://www.livehindustan.com/jharkhand/simdega/story-political-parties-use-obc-as-vote-bank-udasan-9313683.html,yes,0,1,1,1,0,0,0,0,1," “अब तक राजनीतिक दलों ने ओबीसी समुदाय को सिर्फ वोट बैंक के रूप में इस्तेमाल किया है।” this is framing bias like they are showing in wrong point of view      “सरकार ने अनदेखी की… अधिकार से वंचित रखा गया।” “ओबीसी समुदाय आगामी चुनाव में NOTA का प्रयोग करेगा।” (anger + protest emotion)   and framing because showing only one side only --obc
",yes,1,1,1,0,0,0,0,0,1,"1. Clickbait bias => “राजनीतिक दल ओबीसी को वोट बैंक के रूप में करते हैं इस्तेमाल: उदासन” 2. Emotional bias => OBC are repeatedly shown as being underprivileged 3. Selection bias => Statements criticizing the government and political parties for treating OBCs as a “vote bank” are included, but no response, justification, or alternative viewpoint from the government or other political actors is presented. 4. Framing bias => The issue is framed as a systematic injustice and betrayal (“हमेशा से हमारा हक मारा गया”, “सिर्फ वोट बैंक के रूप में इस्तेमाल”), The narrative frames political parties uniformly as exploitative, shaping reader interpretation before independent evaluation."
Live Hindustan,2024-02-12 0:45:22,https://www.livehindustan.com/bihar/munger/story-my-political-identity-from-jamui-chirag-9314061.html,no,0,0,0,0,0,0,0,0,0,,no,0,0,0,0,0,0,0,0,0,
Live Hindustan,2024-02-12 10:37:48,https://www.livehindustan.com/gadgets/story-meta-will-not-suggest-political-content-on-instagram-and-threads-from-now-9314754.html,no,0,0,0,0,0,0,0,0,0,,no,0,0,0,0,0,0,0,0,0,
Live Hindustan,2024-02-12 18:00:53,https://www.livehindustan.com/jharkhand/godda/story-bdo-held-a-meeting-with-representatives-of-political-parties-9315879.html,no,0,0,0,0,0,0,0,0,0,,no,0,0,0,0,0,0,0,0,0,
Live Hindustan,2024-02-12 18:28:49,https://www.livehindustan.com/rajasthan/story-rajasthan-police-clg-members-engaged-in-political-activities-in-police-stations-will-be-removed-9315998.html,no,0,0,0,0,0,0,0,0,0,,no,0,0,0,0,0,0,0,0,0,
Live Hindustan,2024-02-13 0:31:12,https://www.livehindustan.com/uttar-pradesh/amroha/story-social-political-and-economic-upliftment-of-kshatriya-rajput-society-is-the-goal-madan-chauhan-9316588.html,no,0,0,0,0,0,0,0,0,0,,no,0,0,0,0,0,0,0,0,0,
Live Hindustan,2024-02-12 22:55:06,https://www.livehindustan.com/uttar-pradesh/raebareli/story-all-political-parties-should-cooperate-to-increase-voting-percentage-9317339.html,yes,0,0,0,0,0,0,0,0,0,,no,0,0,0,0,0,0,0,0,0,
Live Hindustan,2024-02-12 22:55:13,https://www.livehindustan.com/uttar-pradesh/bijnor/story-bsp-mp-maluk-nagar-reaches-rld-office-political-discussion-intensifies-9317353.html,yes,0,0,1,1,0,1,0,0,1,"Emotional Bias-उनके इस कदम के सियासी हलके में अलग ही कयास लगाए जा रहे हैं।, Stance Bias-मलूक नगर का रालोद दफ्तर पहुंचना खटक रहा है",yes,0,0,1,1,0,1,0,0,1,"1. Emotional bias => Mild becasue of the language used, and slight anti views towards BSP 2. Linguistic bias, Framing bias => “सियासी हलके में अलग ही कयास लगाए जा रहे हैं” and ""वे हार का मुँह देख चुके थे।"" and ""मलूक जीतने से पहले हार की हैट्रिक लगा चुके थे।"" 3. Stance bias => Opening statements and some choice of words seems against BSP 4. Framing bias => Formation of sentences as described in 2. "
Live Hindustan,2024-02-12 23:00:14,https://www.livehindustan.com/jharkhand/lohardaga/story-teli-samaj-will-introduce-political-awareness-sunil-9317425.html,yes,0,1,0,0,1,0,0,0,0,Ideology Bias-अब तेली समाज भी पहले जाति फिर पार्टी के तर्ज पर चलकर बंधुआगिरी नहीं बल्कि जागरूकता का परिचय देगा।,yes,0,1,0,0,1,0,0,0,0,"1. Selection bias => The report focuses only on the तेली समाज, their leaders, views, and participation, with no other communities or counter-views included. 2. Ideology bias => Caste-based political mobilization creates bias by prioritizing one community’s identity and interests over inclusive, equal representation of all groups."
Live Hindustan,2024-02-13 1:16:26,https://www.livehindustan.com/bihar/purnia/story-the-pride-of-the-person-doing-horse-trading-politics-is-broken-9318397.html,yes,1,0,1,1,0,1,0,0,0,"Framing Bias -खरीद फरोख्त की राजनीति करने वाले का टूटा घमंड,Stance Bias-हमारी डबल इंजन सरकार प्रधानमंत्री नरेंद्र मोदी और मुख्यमंत्री नीतीश कुमार के नेतृत्व में बिहार के समग्र विकास के लिए काम करेगी, seems pro-BJP",yes,1,0,1,1,0,1,0,0,0,1. Clickbait bias => खरीद–फरोख्त की राजनीति करने वालों का घमंड टूट गया। 2. Stance bias=> Has a pro-BJP stance 3. Linguistic bias => लालू यादव की रणनीति से तेजस्वी यादव का खेल उलट गया। 4. Framing bias => Story packed in such a way to glorify BJP's victory
Live Hindustan,2024-02-13 2:00:27,https://www.livehindustan.com/bihar/munger/story-karpoori-thakur-was-an-example-of-simplicity-humility-honesty-and-hard-work-in-indian-politics-ddc-9318627.html,no,0,0,0,0,0,0,0,0,0,,no,0,0,0,0,0,0,0,0,0,
Live Hindustan,2024-02-13 17:45:19,https://www.livehindustan.com/jharkhand/ranchi/story-nsui-termed-politicization-of-paper-leak-as-unfortunate-9320101.html,yes,0,1,1,0,0,1,0,0,0,"Stance Bias-भाजपा की ओर से जानबूझकर छात्रों के भविष्य के साथ राजनीतिकरण किया जा रहा है, वह सही नहीं है।,Selection Bias-(Entire report contains only NSUI’s view),Framing Bias-अपनी राजनीतिक रोटी सेंकने से मतलब है।",yes,0,1,1,0,0,1,0,0,0,"1. Selection bias, Stance bias => Only one party’s (एनएसयूआई) perspective is presented; no response from BJP or neutral sources. 2. Framing bias => Phrases like “राजनीतिक रोटी सेंकने” and “साजिश” add charged framing."
Live Hindustan,2024-03-11 18:00:17,https://www.livehindustan.com/jharkhand/garhwa/story-bjp-plays-politics-of-neither-developing-nor-allowing-development-mithilesh-9514219.html,yes,1,1,1,0,0,1,0,0,0,"1. Selection bias => The article only selects quotes and data from Minister Mithilesh Thakur. By choosing not to interview a BJP representative or an independent economic analyst, the author ensures the reader only sees one side of the conflict. There is a total omission of the BJP’s specific counter-arguments or any data that might contradict the Minister's claims about the ""empty treasury."" 2. Framing bias => Tells the reader how to feel about the side being shown, that is only shows inclusion of anti-BJP views, manipulating reader's views. 3. Stance bias => Only anti-BJP quotes 4. Clickbait bias =>  विकास न करेंगे न करने देंगे की राजनीति करती है भाजपा : मिथिलेश",yes,1,1,1,0,0,1,0,0,0,"1. Selection bias => The article only selects quotes and data from Minister Mithilesh Thakur. By choosing not to interview a BJP representative or an independent economic analyst, the author ensures the reader only sees one side of the conflict. There is a total omission of the BJP’s specific counter-arguments or any data that might contradict the Minister's claims about the ""empty treasury."" 2. Framing bias => Tells the reader how to feel about the side being shown, that is only shows inclusion of anti-BJP views, manipulating reader's views. 3. Stance bias => Only anti-BJP quotes 4. Clickbait bias =>  विकास न करेंगे न करने देंगे की राजनीति करती है भाजपा : मिथिलेश"
Live Hindustan,2024-03-11 18:30:07,https://www.livehindustan.com/ncr/new-delhi/story-electoral-bonds-information-about-those-who-donated-to-political-parties-through-electoral-bonds-before-the-banks-are-closed-election-commission-9514431.html,no,0,0,0,0,0,0,0,0,0,,no,0,0,0,0,0,0,0,0,0,
Live Hindustan,2024-03-11 19:00:26,https://www.livehindustan.com/uttar-pradesh/pratapgarh-kunda/story-sdm-held-a-meeting-with-representatives-of-political-parties-9514794.html,no,0,0,0,0,0,0,0,0,0,,no,0,0,0,0,0,0,0,0,0,
Live Hindustan,2024-03-11 20:00:25,https://www.livehindustan.com/bihar/begusarai/story-model-code-of-conduct-taught-to-political-parties-9515168.html,yes,1,0,0,0,0,0,0,0,0,,no,1,0,0,0,0,0,0,0,0,1. Clickbait bias => राजनीतिक दलों को आदर्श आचार संहिता का पाठ पढ़ाया गया।
Live Hindustan,2024-03-11 22:00:07,https://www.livehindustan.com/ncr/new-delhi/story-left-parties-are-becoming-irrelevant-in-national-politics-due-to-continuous-decrease-in-seats-9515789.html,yes,0,0,1,1,0,1,0,0,0,"Framing Bias:लगातार सीटें घटने से राष्ट्रीय राजनीति में अप्रासंगिक हो रहे वामदल”,2004 के बाद वाम मोर्चे का प्रदर्शन लगातार खराब होता गया।,वाममोर्चा के खराब प्रदर्शन के कई कारण हैं",yes,0,0,1,1,0,0,0,0,0,"Weak , selection bias , only shown that the vote share of particular party in decreasing , but not the achievements of party , indirectly giving benefit to BJP , also article is framed such that to show stronghold of seats by BJP."
Live Hindustan,2024-03-11 23:15:08,https://www.livehindustan.com/jharkhand/chatra/story-meeting-held-with-president-secretary-district-unit-of-all-recognized-political-parties-regarding-change-of-name-of-polling-stations-9516363.html,no,0,0,0,0,0,0,0,0,0,,no,0,0,0,0,0,0,0,0,0,
Live Hindustan,2024-03-12 0:15:05,https://www.livehindustan.com/jharkhand/hazaribagh/story-bread-donation-program-organized-in-prospective-pg-political-science-department-9516961.html,no,0,0,0,0,0,0,0,0,0,,no,0,0,0,0,0,0,0,0,0,"Might be little bit of framing bias , need to decide on it"
Live Hindustan,2024-03-12 0:16:06,https://www.livehindustan.com/uttar-pradesh/sambhal/story-struggle-between-son-and-grandson-over-dr-burke-39-s-political-legacy-9517035.html,yes,0,1,1,1,0,1,0,0,1,"डॉ. बर्क की सियासी विरासत को लेकर बेटे-पोते में खींचतान,हलचल, खींचतान, मुश्किल, विश्वास हो गया,लोगों को विश्वास हो गया था कि पोते जियाउर्रहमान को टिकट मिल जाएगा।”",yes,0,0,1,1,0,0,1,0,0,"1- Framing bias -Whole article is framed as a political dispute , 2- selection bias- all the things represented are only of son and not father , 3-Stance bias-sensetional  claims are made."
Live Hindustan,2024-03-12 0:45:11,https://www.livehindustan.com/bihar/bagaha/story-39-bjp-is-doing-vote-politics-with-caa-9517291.html,yes,0,1,1,0,0,1,0,0,1,इधर भारतीय राष्ट्रीय कांग्रेस के जिलाध्यक्ष भारत भूषण दुबे ने कहा कि सरकार चुनाव से पहले सीएए लागू कर रही है। भाजपा वोट की राजनीति के लिए सीएए लागू कर अपने पक्ष में माहौल बनाना चाहती है।,yes,0,0,1,1,0,0,1,0,0,"1-headline indicates strong stancer, 2-framing bias - whole article is framed such that bjp is utilizing caa , and it is wrong , 3- selection bias-  no counter arguments , supreme court judgements , etc , given."
Live Hindustan,2024-03-12 12:01:16,https://www.livehindustan.com/elections/lok-sabha-elections/story-caa-rules-notification-impact-why-mamata-banerjee-opposing-caa-know-bjp-political-calculation-through-eight-seats-of-bengal-9519799.html,yes,0,1,1,0,0,1,0,0,0,केंद्र सरकार के सर्वे में भी इसे लागू करने का फायदा भाजपा को मिलता दिख रहा था। इसलिए भाजपा सरकार ने चुनावों से ऐन पहले इसे लागू करने का दांव चला है।,yes,0,0,1,1,0,1,1,0,0,"1-Framing bias- Indicates the caa protest is not a protest of opposition , but a political tool of defence, 2-stance bias - bjp is shown as a tactical party while tmc is shown as a party of defensive approach. 3-Mild linguistic bias."
Live Hindustan,2024-03-12 12:21:38,https://www.livehindustan.com/bihar/story-video-tejashwi-yadav-doing-cow-sewa-within-busy-schedule-of-politics-rjd-leader-said-this-on-lalu-yadav-rabri-devi-9519899.html,yes,0,1,0,0,0,0,0,0,0,,yes,1,0,0,0,0,0,1,0,0,"1- Stance bias- tejasvi yadav is shown as a good , kind person , 2- emotional bias- words like , mamta , shradha , etc are used."
Live Hindustan,2024-03-12 16:01:42,https://www.livehindustan.com/national/story-amit-shah-slammed-congress-opposing-citizenship-amendment-act-caa-vote-bank-politics-9520908.html,yes,0,0,0,0,0,1,0,0,1,"कांग्रेस पार्टी 70 साल तक राम मंदिर के मुद्दे को लटकाती रही, भटकाती रही, अटकाती रही। वोट बैंक के लालच में कांग्रेस ने राम मंदिर की प्राण-प्रतिष्ठा का बहिष्कार किया।",yes,0,0,1,1,0,0,1,0,0,"1- Selection bias - only opinion of amit shah was presented , no reaction from opposition , 2- stance bias - congress is shown as a weak party and only amit shah is correct "
Live Hindustan,2024-03-12 18:01:12,https://www.livehindustan.com/jharkhand/chaibasa/story-caa-notification-before-lok-sabha-elections-a-serious-political-conspiracy-bir-singh-biruli-9521862.html,yes,0,0,1,1,1,1,0,0,1,"Linguistic Bias-लोकसभा चुनाव से पहले सीएए की अधिसूचना गंभीर राजनीतिक साजिश,Framing Bias-लोकसभा चुनाव से पहले सीएए की अधिसूचना गंभीर रा headline frames the government action as a “serious conspiracy.”,जनीतिक साजिश,Stance Bias-काफी खतरनाक संकेत Only the criticizing side is represented; no balance, Emotional Bias-काफी खतरनाक”, Emotionial Bias-देश से बाहर निकालने तक-trigger emotional reactions like fear, threat, or insecurity, Ideological Bias-सीएए को धर्म के आधार पर बांटने वाला बताया गया-CAA = religious division",yes,0,0,1,1,0,0,1,0,0,"1- stance bias- can be clearly seen in the wedding , 2- caa is framed as negative thing , 3- selection bias- only  viewpoint of a person is given."
Live Hindustan,2024-03-12 18:45:37,https://www.livehindustan.com/bihar/araria/story-political-heat-on-caa-war-of-words-between-party-and-opposition-9522300.html,yes,0,0,1,1,0,0,0,0,0,"“The article contains slight framing and linguistic bias through words like ‘सियासी गर्माहट’ and ‘जुबानी जंग’, which add a dramatic tone. However, the bias is negligible because both ruling and opposition viewpoints are included, and no side is favored.”",no,0,0,0,0,0,0,0,0,0,
Live Hindustan,2024-03-12 20:25:04,https://www.livehindustan.com/uttar-pradesh/shravasti/story-dm-inspected-the-warehouse-in-the-presence-of-political-parties-9522850.html,no,0,0,0,0,0,0,0,0,0,,no,0,0,0,0,0,0,0,0,0,
Live Hindustan,2024-03-12 21:00:07,https://www.livehindustan.com/ncr/new-delhi/story-strategy-to-help-backward-people-with-non-jat-politics-in-haryana-9523053.html,yes,0,1,1,1,1,1,0,0,0,"Framing Bias - हरियाणा में गैर जाट राजनीति के साथ पिछड़ों को साधने की रणनीति frame the CM change not neutrally but as a calculated caste move,Linguistic Bias - अपनी पकड़ मजबूत करना टपट, खटास, साधने, पकड़ add drama and negativity, not neutral description, Stance Bias -पार्टी में अंदरूनी खटपट हमेशा बनी रही Only negative internal issues are emphasized,Ideology Bias -ओबीसी समुदाय पर अपनी पकड़ मजबूत करना report interprets BJP actions through the lens of caste ideology without presenting alternative governance or development reasoning.",yes,0,0,1,1,1,0,1,0,0,
Live Hindustan,2024-03-13 1:30:24,https://www.livehindustan.com/bihar/katihar/story-meeting-of-various-political-parties-will-be-held-in-dandkhora-today-9525542.html,no,0,0,0,0,0,0,0,0,0,,no,0,0,0,0,0,0,0,0,0,
Live Hindustan,2024-03-13 2:16:02,https://www.livehindustan.com/jharkhand/dhanbad/story-flags-of-only-three-political-parties-on-private-buildings-9525783.html,no,0,0,0,0,0,0,0,0,0,,no,0,0,0,0,0,0,0,0,0,
Live Hindustan,2024-03-13 2:30:40,https://www.livehindustan.com/jharkhand/dhanbad/story-bbmku-drc-meeting-in-the-department-of-political-science-9525935.html,no,0,0,0,0,0,0,0,0,0,,no,0,0,0,0,0,0,0,0,0,
Live Hindustan,2024-03-13 20:55:04,https://www.livehindustan.com/uttar-pradesh/lucknow/story-for-the-opposition-government-we-do-politics-of-nation-building-rajnath-singh-9530588.html,yes,0,1,1,1,0,1,0,0,1,"Framing Bias-विपक्षी सरकार के लिए, हम राष्ट्र निर्माण की राजनीति करते हैं – राजनाथ सिंह”promotes a contrast: “Opposition bad, we good”,Linguistic Bias-हमारे नेतृत्व में जोरदार विकास हुआ हैthey elevate one side and belittle the other,Emotional Bias-हमारी सरकार… पूरी तरह से समर्पित है।provoke emotional support (hope, pride) toward one party.",yes,0,0,1,0,0,0,0,0,0,"1- selection bias , only comment of rajnath singh is shown , no reaction from opposition."
Live Hindustan,2024-03-13 22:45:07,https://www.livehindustan.com/bihar/patna/story-yogi-enters-bihar-politics-will-beat-in-shivhar-9531574.html,yes,0,1,1,1,1,1,0,0,1,"Emotional Bias-हिंदुत्ववादी छवि”,विशिष्ट पहचान”,विराट हिंदू संत सम्मेलन -Religion + identity + pride = emotional influence,Stance Bias-उन्हें टिकट नहीं मिला तो वे निर्दलीय भी चुनाव में ताल ठोक सकते हैं। Ideological Bias - देश के कई प्रसिद्ध संत… और दो शंकराचार्य भी आए”promotes Hindutva-linked ideological frame without balance.",yes,0,0,0,1,0,0,1,0,0,"1- framing bias- article is framed in such a way that , the candidate is good candidate , hindutva chavi , 2- stance bias- the article is phrased such that , candidate is trying to establish himself , and is a good person , and  bjp have a lead here."
Live Hindustan,2024-03-13 23:30:06,https://www.livehindustan.com/uttar-pradesh/shamli/story-guptagu-reached-out-to-jayant-39-s-leaders-to-gauge-his-political-influence-9531792.html,no,0,0,0,0,0,0,0,0,0,,no,0,0,0,0,0,0,0,0,0,
Live Hindustan,2024-03-13 23:35:06,https://www.livehindustan.com/uttar-pradesh/shamli/story-kashyap-society-has-been-deceived-by-political-parties-naresh-kashyap-9531972.html,yes,0,0,0,0,0,0,1,0,0,"reporter’s tone is neutral (no personal linguistic bias), but the article shows structural bias because it presents only one political leader’s accusations",yes,0,0,0,1,0,0,0,0,0,"1- framing bias , article is framed such that kashyp samaj is being opressed."
Live Hindustan,2024-04-12 8:10:51,https://www.livehindustan.com/uttar-pradesh/story-akhilesh-yadav-and-deputy-cm-keshav-maurya-will-come-to-pilibhit-12-april-will-attack-each-other-politically-9745188.html,no,0,0,0,0,0,0,0,0,0,,yes,0,0,0,0,0,0,1,0,0,1- stance bias- the author assumes that two party leaders will surely attack each other.
Live Hindustan,2024-04-12 0:00:11,https://www.livehindustan.com/bihar/gopalganj/story-after-the-prayers-politics-and-election-issues-were-also-discussed-9745930.html,no,0,0,0,0,0,0,0,0,0,,no,0,0,0,0,0,0,0,0,0,
Live Hindustan,2024-04-12 10:37:50,https://www.livehindustan.com/bihar/story-misa-bharti-statement-on-pm-modi-created-a-political-uproar-after-jp-nadda-vinod-tawde-attack-on-lalu-daughter-9748521.html,yes,0,0,0,0,0,1,1,0,1,"Stance Bias-बिहार बीजेपी प्रभारी विनोद तावड़े ने लालू की बेटी पर पलटवार किया। यह नीचले स्तर की राजनीति है।”classic stance bias → giving one side moral high-ground and portraying the other as wrong or immoral,linguistic/slant biasअभद्र टिप्पणी”",yes,0,0,1,1,0,0,0,0,0,"1- framing bias- article framed such that , a statement is really explosive and shocked the world , selection bias- more views of opposition party leaders(BJP) shown."
Live Hindustan,2024-04-12 11:15:13,https://www.livehindustan.com/uttar-pradesh/prayagraj/story-neeraj-tripathi-will-take-over-his-father-39-s-political-legacy-9748727.html,no,0,0,0,0,0,0,0,0,0,,no,0,0,0,0,0,0,0,0,0,
Live Hindustan,2024-04-12 11:17:03,https://www.livehindustan.com/national/story-pm-narendra-modi-says-only-3-percent-ed-cases-against-political-leader-9748716.html,yes,0,0,1,0,0,1,1,0,0,"Stance Bias-जिन लोगों को भ्रष्ट व्यवस्था में फायदा दिखता है, वे लोगों के सामने गलत तस्वीर पेश कर रहे हैं।Framing Bias Lines:ईडी ने हजारों करोड़ों की संपत्ति जब्त की है।""गरीबों का पैसा बिचौलियों के हाथ में नहीं जाने दिया।",yes,0,0,1,0,0,0,0,0,0,"1- selective bias , only viewpoint of PM Modi represented , no actual figures reported."
Live Hindustan,2024-04-12 11:37:43,https://www.livehindustan.com/bihar/story-during-lok-sabha-election-2024-rating-of-fish-and-oranges-increased-in-bihar-politics-how-far-did-the-debate-reach-who-said-what-know-here-9748734.html,yes,0,1,1,1,0,1,1,0,1,"Biased Hindi Lines:बिहार की सियासत में मछली और संतरे की बढ़ी रेटिंग; कहां तक पहुंची बहस…,Stance Bias- यह नीचले स्तर की राजनीति है। rticle presents long, detailed criticism from BJP and JDU but gives minimal defense from Tejashwi ,Emotional Bias-नवरात्र में उपवास करने वालों का मजाक उड़ा रहे हैं",no,0,0,0,0,0,0,0,0,0,
Live Hindustan,2024-04-12 12:15:17,https://www.livehindustan.com/uttar-pradesh/gorakhpur/story-javed-simnani-who-raised-the-bsp-flag-from-student-politics-got-the-ticket-9748969.html,yes,0,0,1,1,0,1,0,0,1,"Framing Bias- जावेद सिमनानी बताते हैं कि जनता जानती है कि वह गोरखपुर के बेटे हैं,Linguistic Bias- गोरखपुर के बेटे हैं -बेटे, दमखम, बाहर के प्रत्याशी carry emotional charge and preference.",yes,0,0,1,1,0,0,0,0,0,"1- selective bias , viewpont of oppostion candidate is not given , 2- framing bias - candidate is shown as very experienced old candidate."
Live Hindustan,2024-04-12 12:45:09,https://www.livehindustan.com/weather/story-amid-political-turmoil-temperature-in-cities-increased-by-several-degreesuttarakhand-weather-forecast-9749094.html,no,0,0,0,0,0,0,0,0,0,,no,0,0,0,0,0,0,0,0,0,
Live Hindustan,2024-04-12 15:58:07,https://www.livehindustan.com/elections/lok-sabha-elections/story-phulpur-lok-sabha-political-equation-pandit-nehru-seat-where-many-stalwarts-fell-face-down-9749873.html,yes,0,0,1,1,0,1,1,0,1,"Stance Bias-कांग्रेस की जमीन फूलपुर में दरकने लगी।”,“यहां विकास और रोजगार से जुड़े काम नहीं हुए।,lines take a position that Congress failed — without showing the party’s counter-view.Emotional Bias-नेहरू के बाद जमीन दरकती गई।”,“जनता ने नकार दिया।”",no,0,0,0,0,0,0,0,0,0,
Live Hindustan,2024-04-12 16:45:11,https://www.livehindustan.com/uttarakhand/rishikesh/story-pledged-for-cleanliness-and-purity-of-politics-9750193.html,no,0,0,0,0,0,0,0,0,0,,no,0,0,0,0,0,0,0,0,0,
Live Hindustan,2024-04-12 19:15:05,https://www.livehindustan.com/uttar-pradesh/lucknow/story-lok-sabha-elections-the-third-door-of-the-chakravyuh-is-open-political-warriors-will-enter-the-fray-9751273.html,yes,0,0,0,0,0,0,0,0,0,"This is linguistic + framing bias, but it does NOT favour any party.This is common in Indian election reporting — just dramatic writing.",no,0,0,0,0,0,0,0,0,0,
Live Hindustan,2024-04-12 19:15:08,https://www.livehindustan.com/uttar-pradesh/mainpuri/story-two-sides-clashed-over-political-talks-9751287.html,no,0,0,0,0,0,0,0,0,0,,no,0,0,0,0,0,0,0,0,0,
Live Hindustan,2024-04-12 20:00:19,https://www.livehindustan.com/uttar-pradesh/moradabad/story-politics-should-not-be-limited-to-slogans-development-should-be-without-bias-9751683.html,no,0,0,0,0,0,0,0,0,0,,no,0,0,0,0,0,0,0,0,0,
Live Hindustan,2024-04-12 20:45:21,https://www.livehindustan.com/jharkhand/ranchi/story-indie-thugbandhan-does-politics-for-money-and-family-babulal-9751967.html,yes,0,1,1,1,1,1,0,0,1,"Selection Bias-पैसे और परिवार के लिए इंडी गठबंधन राजनीति करता है, इनका जनता से कोई लेना-देना नहीं है।”,Framing Bias - पूरे देश में सनातन विरोधी एक मंच पर आ रहे हैं, पर देश की जनता को … मोदी पर भरोसा है।”This frames the contest as ideological and moral, not just political competition.Stance Bias-हमलोगों ने भाजपा की सदस्यता ग्रहण की है एवं मोदी के नेतृत्व में तीसरी बार केंद्र में एनडीए की सरकार बने के लिए हम सब…”The stance is supportive of BJP’s narrative. Emotional Bias: “…जनता को अपने प्रधानमंत्री नरेंद्र मोदी पर भरोसा है…”Emotional appeal to trust, loyalty.",yes,0,0,1,0,0,0,0,0,0,
Live Hindustan,2024-04-12 21:15:17,https://www.livehindustan.com/bihar/chapra/story-randomization-took-place-in-the-presence-of-representatives-of-political-parties-9752148.html,no,0,0,0,0,0,0,0,0,0,,no,0,0,0,0,0,0,0,0,0,
Live Hindustan,2024-04-12 22:18:37,https://www.livehindustan.com/himachal-pradesh/story-kangana-gave-challenge-and-says-if-he-speaks-a-dialogue-from-my-film-will-i-leave-politics-or-india-9752101.html,yes,0,1,1,1,0,1,1,0,1,"Selection Bias:अगर वह मेरी फिल्म का एक डायलॉग बोलकर दिखा दें तो मैं राजनीति क्या भारत छोड़ दूंगी।”,Framing Bias: - तो राजनीति क्या भारत छोड़ दूंगी” (headline mood) ,Stance Bias - मैं लोगों की सेवा करना चाहती हूँ। clearly presents Kangana’s viewpoint favorably ,Emotional Bias:मंडी की बेटी राजनीति में अपना भविष्य ढूंढ रही है तो कांग्रेस को मिर्ची क्यों लग रही है?",yes,0,0,0,0,0,0,1,0,0,1- stance bias- they have written again and again khuli chunauti de daali.
Live Hindustan,2024-04-12 21:42:11,https://www.livehindustan.com/uttarakhand/story-cm-dhami-is-champion-of-politics-defense-minister-rajnath-singh-said-political-parties-were-out-9752291.html,yes,0,0,1,1,0,1,0,0,0,,yes,0,0,1,1,0,0,1,0,0,
Live Hindustan,2024-04-12 22:00:32,https://www.livehindustan.com/bihar/biharsharif/story-there-will-be-no-programs-related-to-political-parties-in-kundalpur-mahotsav-9752457.html,yes,0,1,1,0,0,0,0,0,0,“कोई भी कार्यक्रम राजनीतिक दलों व पार्टियों से संबंधित न हो … का विशेष ध्यान रखने का आदेश दिया,no,0,0,0,0,0,0,0,0,0,
Live Hindustan,2024-04-12 22:00:33,https://www.livehindustan.com/bihar/hajipur/story-20-meetings-held-with-representatives-of-political-parties-9752461.html,no,0,0,0,0,0,0,0,0,0,,no,0,0,0,0,0,0,0,0,0,
Live Hindustan,2024-04-12 22:15:13,https://www.livehindustan.com/ncr/faridabad/story-the-city-magistrate-held-a-meeting-with-representatives-of-various-political-parties-9752513.html,yes,0,1,1,0,0,1,0,0,0,नगराधीश अंकित कुमार ने जिले की राजनीतिक पार्टियों के प्रतिनिधियों के साथ बैठक की … निर्वाचन आयोग की हिदायतों के अनुसार बिना अनुमति के … एफआईआर दर्ज कराई जाएगी।“कोई भी जनसभा बिना अनुमति के नहीं की जाएगी … सभी की अनुमति प्राप्त करके चुनाव कार्य करवाया जाए।”,no,0,0,0,0,0,0,0,0,0,
Live Hindustan,2024-04-12 22:50:33,https://www.livehindustan.com/blog/mancha-vacha-karmna/story-hindustan-mansa-vacha-karmana-column-why-be-afraid-of-politics-13-april-2024-9752765.html,yes,0,0,1,1,1,0,0,0,0,"“राजनीति को तुम्हें अपने मार्ग से डगमगाने की शक्ति न दो। यदि तुम उससे डरते हो, तो तुम आध्यात्मिक क्षेत्र में सफल नहीं हो सकते।सबल व्यक्ति राजनीति से हंसते हुए निकल जाएंगे और कमजोर रोते रहेंगे!",no,0,0,0,0,0,0,0,0,0,
Live Hindustan,2024-04-12 23:30:21,https://www.livehindustan.com/jharkhand/ghatsila/story-co-held-a-meeting-with-representatives-of-political-parties-9753222.html,no,0,0,0,0,0,0,0,0,0,,no,0,0,0,0,0,0,0,0,0,
Live Hindustan,2024-04-12 23:45:07,https://www.livehindustan.com/uttar-pradesh/shamli/story-political-temperature-is-rising-as-elections-come-closer-9753356.html,yes,0,1,1,1,0,1,0,0,0,अब तक की बात की जाए तो … भाजपा से जहाँ मुख्यमंत्री से लेकर कई बड़े नेता क्षेत्र का दौरा कर चुके हैं। … वहीं … विपक्षी दलों की ओर से कोई किसी बड़े नेता का कार्यक्रम अब तक नहीं हुआ है।,no,0,0,0,0,0,0,0,0,0,
Live Hindustan,2024-04-13 1:30:08,https://www.livehindustan.com/uttar-pradesh/meerut/story-a-big-political-decision-can-be-taken-in-the-monthly-meeting-of-bhakiyu-9754423.html,yes,0,1,1,0,0,0,0,0,0,,no,0,0,0,0,0,0,0,0,0,
Live Hindustan,2024-04-13 2:00:36,https://www.livehindustan.com/bihar/purnia/story-political-talks-banned-during-ram-navami-procession-9754758.html,no,0,0,0,0,0,0,0,0,0,not much related to politics,no,0,0,0,0,0,0,0,0,0,
Live Hindustan,2024-04-13 7:38:24,https://www.livehindustan.com/uttar-pradesh/story-up-lok-sabha-elections-2024-congress-sp-leaders-will-together-lay-the-chessboard-on-these-seats-of-up-will-create-political-atmosphere-9755714.html,no,0,0,0,0,0,0,0,0,0,,no,0,0,0,0,0,0,0,0,0,
Live Hindustan,2024-04-13 9:45:12,https://www.livehindustan.com/national/story-nehru-had-to-break-his-pledge-because-of-lohia-read-that-political-story-of-phulpur-9756082.html,yes,0,0,0,1,0,0,0,0,0,“उन्होंने चुनाव में बहुत बड़े अंतर से हार का सामना किया।” even though there are numbers mentione below it is given a hug loss again,no,0,0,0,0,0,0,0,0,0,
Live Hindustan,2024-04-13 10:23:28,https://www.livehindustan.com/bihar/story-politics-continues-on-misa-bharti-statement-on-pm-modi-sending-to-jail-nityanand-rai-said-the-public-will-break-pride-9756209.html,yes,1,1,1,1,0,1,1,0,1,"“जनता घमंड तोड़ देगी”    Bias: Emotional Bias + Framing Bias stnace bias because the whole article the anchor was one sided and left the other--> omission bias framing because“अगर INDIA गठबंधन की सरकार बनी तो पीएम नरेंद्र मोदी जेल में होंगे।”
  ",yes,0,0,1,0,0,0,0,0,1,"messiah quote, last paragraph"
Live Hindustan,2024-04-13 11:46:23,https://www.livehindustan.com/rajasthan/story-rajasthan-politics-bjp-teased-vasundhara-raje-by-inducting-manvendra-singh-into-the-party-9756529.html,yes,0,1,1,1,0,0,0,0,1,"“राजस्थान की राजनीति में स्तिथि जटिल, गहरे रिश्ते धोखेबाज…” (Linguistic Bias    Rajasthan politics is complicated and relationships are tricky/clever.""      खुद मानवेन्द्र सिंह कई बार खुले तौर पर वसुंधरा राजे पर निशाना साध चुके हैं Emotional Bias Manvendra Singh has openly targeted Vasundhara Raje many times. “दीया कुमारी ने साधे एक तीर से कई निशाने” “Diya Kumari hit multiple targets with one arrow. (Framing Bias)",yes,0,0,1,1,0,1,0,0,1,seems like gossip reporting of one side with emotion added by journalist
Live Hindustan,2024-04-13 19:15:07,https://www.livehindustan.com/ncr/new-delhi/story-farooq-abdullah-not-contesting-elections-is-not-the-end-of-his-political-career-omar-9759022.html,yes,0,1,1,1,0,0,0,0,1,“लेकिन इस बयान का मतलब यह नहीं है कि उनका चुनावी करियर अब खत्म हो गया है।” Framing Bias “But this statement does not mean that his political career is finished.” “भारतीय जनता पार्टी की ओर से प्रतिद्वंद्वियों पर वंशवाद की राजनीति को बढ़ावा देने का आरोप लगाया जाता रहा है…” Selection Bias Selection Bias “यह वंशवाद की राजनीति नहीं है?”“Is this not dynasty politics?” (Linguistic Bias),no,0,0,0,0,0,0,0,0,0,"am confused with this news article, it seems biased but I dont know what to do when politicians are themselves biased and take examples to justify ther wrongdoing"
Live Hindustan,2024-04-14 0:15:39,https://www.livehindustan.com/bihar/lakhisarai/story-warehouse-inspection-in-front-of-political-parties-9761484.html,no,0,0,0,0,0,0,0,0,0,not mostly related to pilitics,no,0,0,0,0,0,0,0,0,0,reporting of information but last paragraph seems extra information
Live Hindustan,2024-04-14 0:30:19,https://www.livehindustan.com/uttar-pradesh/jaunpur/story-bp-mandal-39-s-recommendations-changed-the-politics-of-india-9761588.html,yes,0,0,0,1,0,0,0,0,0,“राजनीति बदल दी”  linguistic,yes,1,0,0,1,0,0,0,0,1,"emotional and linguistic because of the way of presentation seems emotionally charged, framing not sure. clickbait because of headline is attention seeking althouth news article is relevant to headline"
Live Hindustan,2024-04-14 1:16:05,https://www.livehindustan.com/uttar-pradesh/maharajganj/story-political-parties-will-woo-dalit-voters-on-dr-bhimrao-ambedkar-39-s-birth-anniversary-9761984.html,yes,0,1,1,1,0,0,0,0,1," “पिछले दो चुनाव में भाजपा की प्रचंड जीत में दलित वोट की भूमिका निर्णायक रही।” Linguistic Bias + Selection Bias “जिले की आबादी 33 लाख के करीब है। इसमें से 18 % अनुसूचित जाति की हिस्सेदारी है।”
Framing Bias
",yes,1,0,1,1,0,0,0,1,1,"attention seeking headline, news article induces and reports unfiltered caste based politics, emotional and usage of phrases like the reasoning behind win"
Live Hindustan,2024-04-14 1:16:12,https://www.livehindustan.com/jharkhand/gridih/story-dr-ambedkar-was-an-advocate-of-keeping-religion-separate-from-politics-ramdev-9762002.html,yes,1,0,1,1,0,0,0,0,0,“उन्होंने कहा कि राजनीति में धर्म को घुसाने से लोकतंत्र कमजोर पड़ता है।”Framing Bias “धर्म को घुसाने से”Linguistic Bias,yes,1,0,0,0,0,0,0,0,0,use of same name and catchy headline for a justified article reporting
Live Hindustan,2024-04-14 10:58:10,https://www.livehindustan.com/uttar-pradesh/story-om-prakash-rajbhar-political-skills-will-be-tested-in-the-battle-of-ghosi-all-eyes-are-on-him-up-lok-sabha-election-news-9763557.html,yes,0,1,1,1,0,0,0,0,0,"“बेटे को सांसद बनाने के लिए उन्हें भाजपाइयों को साधना है। पिछड़े वोटों में बिखराव रोकना है। मुख्‍तार अंसारी फैक्टर से निपटना है।”Framing Bias Linguistic Bias
“प्रचंड जीत में दलित वोट की भूमिका निर्णायक रही।” Selection Bias “सपा-बसपा का चक्रव्यूह तोड़ने की चुनौती”",yes,0,0,1,0,0,0,0,0,0,need to recheck
Live Hindustan,2024-04-14 12:15:13,https://www.livehindustan.com/uttar-pradesh/deoria/story-election-season-political-parties-busy-in-garnering-dalit-votes-on-ambedkar-39-s-birth-anniversary-9764177.html,yes,1,0,1,1,1,0,0,0,0,"“इस बार चुनावी मौसम होने के कारण राजनीतिक दल इसके बहाने में दलित मतों में पैठ बनाने की जुगत में हैं।”   Selection Bias वैसे तो राजनीतिक दल हर साल माँ आंबेडकर की जयंती मनाते हैं, लेकिन इस बार चुनावी मौसम होने",yes,1,0,1,1,0,1,0,1,1,"user manipulation by headline, journalist emotion and stance (tnality and reporting)"
Live Hindustan,2024-04-14 15:45:08,https://www.livehindustan.com/bihar/patna/story-in-the-lok-sabha-elections-independents-are-also-claiming-to-spoil-the-political-game-9764993.html,yes,0,1,1,1,0,0,0,1,1,Selection Bias “विनोद यादव ने दावा किया है कि वो इस सीट पर सियासी खेल बिगाड़ने की कुबत रखते हैं।” Framing Bias “लोकसभा चुनाव में निर्दलीय भी कर रहे सियासी खेल बिगाड़ने का दावा।”Fact Bias “जिले की आबादी 33 लाख के करीब है। इसमें से 18 % अनुसूचित जाति की हिस्सेदारी है।” Emotional Bias जनता ने मन बना लिया है कि राजनीतिक दलों के थोपे उम्मीदवार का बोरिया बिस्तर इस बार बांध दिया जाए।”,yes,1,0,1,1,0,1,0,0,1,
Live Hindustan,2024-05-11 23:10:09,https://www.livehindustan.com/uttar-pradesh/sultanpur/story-randomization-of-evms-in-front-of-people-from-political-parties-9971057.html,yes,0,1,1,1,0,0,0,0,0,"Selection Bias“समस्त एसडीएम/एआरओ, सम्बन्धित अधिकारी व मान्यता प्राप्त राजनैतिक दलों एवं अभ्यर्थी/अभ्यर्थियों के निर्वाचन अभिकर्ता उपस्थित रहे।” Framing Bias“ईएमएस पोर्टल के माध्यम से एलईडी टीवी पर पूरी पारदर्शिता के साथ … सूची उपलब्ध करायी गयी।”Linguistic Bias“मतदेय स्थलों की संख्या के 125 प्रतिशत… 134 प्रतिशत का रेंडमाइजेशन किया गया।”",no,0,0,0,0,0,0,0,0,0,
Live Hindustan,2024-05-12 1:15:22,https://www.livehindustan.com/uttar-pradesh/badaun/story-political-science-oral-exam-will-be-held-on-17th-9972211.html,no,0,0,0,0,0,0,0,0,0,,no,0,0,0,0,0,0,0,0,0,
Live Hindustan,2024-05-12 10:04:44,https://www.livehindustan.com/rajasthan/story-rajasthan-politics-will-bhajanlal-lose-his-chair-after-june-4-or-will-he-retain-it-opposition-faction-is-active-9973959.html,yes,0,1,1,1,0,1,0,0,1,"Emotional Bias “राजनीति की धार बदल गई है Stance Bias “भजनलाल शर्मा की कुर्सी हिल रही है।” Selection Bias  “वसुंधरा राजे की अनदेखी का खामियाज़ा बीजेपी को उठाना पड़ सकता है।”
Framing Bias“4 जून को मतगणना के बाद ही सियासी तस्वीर साफ़ हो पाएगी।”Linguistic Bias“सीएम भजनलाल का सिरदर्द बढ़ सकता है।",yes,1,0,1,0,0,0,0,1,0,"written in politicized way both headline and news, otherwise factual reporting"
Live Hindustan,2024-05-12 22:00:10,https://www.livehindustan.com/ncr/new-delhi/story-power-struggle-bjp-accuses-congress-leader-adhir-ranjan-of-political-extortion-9977797.html,yes,0,1,1,1,0,1,0,0,1,"Emotional Bias“राजनीति की धार बदल गई है।”
Stance Bias“भजनलाल शर्मा की कुर्सी हिल रही है।”
Selection Biasवसुंधरा राजे की अनदेखी का खामियाज़ा बीजेपी को उठाना पड़ सकता है।”
Framing Bias“4 जून को मतगणना के बाद ही सियासी तस्वीर साफ़ हो पाएगी।”
Linguistic Bias“सीएम भजनलाल का सिरदर्द बढ़ सकता है।”",yes,1,1,1,1,1,0,1,0,1,"seems to highlight one side much more to influence, one sentence is only written that the threat might was said in a joke manner"
Live Hindustan,2024-05-13 5:55:37,https://www.livehindustan.com/uttar-pradesh/story-2-daughters-are-writing-a-new-script-in-up-politics-after-aditi-now-afzal-s-daughter-nusrat-is-in-the-news-9980615.html,yes,0,1,1,1,0,0,0,0,1,Selection Bias: “उनकी प्रचार शैली चर्चाओं में है। जाति-धर्म का बंधन तोड़कर वे लोगों से मिल रही हैं। Framing Bias: “उपक्रम दो बेटियां नई पटकथा लिख रही हैं।” Linguistic Bias: “पटखने हो गई है चर्चाएं” Emotional Bias: “नई पटकथा लिख रही हैं”,yes,1,0,1,1,0,0,0,0,1,
Live Hindustan,2024-05-13 14:21:35,https://www.livehindustan.com/ncr/story-swati-maliwal-assault-case-took-political-turn-delhi-bjp-came-in-support-of-aap-mp-made-serious-allegations-against-arvind-kejriwal-9982313.html,yes,0,1,1,1,0,0,1,1,1,“दिल्ली भाजपा ने कहा कि कांग्रेस नेता अधीर रंजन सिंह के खिलाफ राजनीतिक ब्लैकमेल का मामला सामने आया है।”Framing Bias “उन्होंने आरोप लगाया कि ये पूरी साजिश है जिसमें पैसे और तस्वीरें सभी शामिल हैं।”Linguistic Bias “भाजपा का कहना है कि उनके पास दस्तावेज हैं जो इस केस को साबित करते हैं।”Selection Bias,yes,0,1,1,1,0,1,1,0,1,
Live Hindustan,2024-05-13 17:15:26,https://www.livehindustan.com/jharkhand/jamshedpur/story-political-parties-do-not-like-players-in-iron-city-9983268.html,yes,0,1,1,1,0,0,1,0,0,Selection Bias: “आजतक किसी भी राजनीतिक दल ने यहां के खिलाड़ियों को अपना प्रत्याशी नहीं बनाया।” Framing Bias: “लौहनगरी में राजनीतिक दलों को नहीं भाते खिलाड़ी” Linguistic Bias: “खिलाड़ियों को … प्रत्याशी नहीं बनाया गया।” Omission Bias: “हालांकि यहां से आईपीएस अजय कुमार … भी सांसद बन चुके हैं।”,yes,1,0,1,1,0,0,0,1,0,
Live Hindustan,2024-05-13 18:00:09,https://www.livehindustan.com/ncr/new-delhi/story-blast-in-kannur-amid-political-tension-9983677.html,yes,0,1,1,1,0,0,1,0,1,Selection Bias “यह घटना उस क्षेत्र में हुई जहां कुछ स्थानीय मुद्दों को लेकर भाजपा और माकपा के कार्यकर्ताओं के बीच तनाव चल रहा था।” Framing Bias“राजनीतिक तनाव के बीच कन्नूर में धमाका” Linguistic Bias “कम तीव्रता का विस्फोट हुआ।” Omission Bias“पुलिस ने कहा कि जब यह विस्फोट हुआ उस दौरान पुलिसकर्मी पास के इलाके में मौजूद थे।”,yes,1,1,1,1,0,0,1,0,1,
Live Hindustan,2024-05-13 19:45:09,https://www.livehindustan.com/jharkhand/ranchi/story-bjp-will-do-third-stream-politics-saryu-rai-9984276.html,yes,0,1,1,1,0,0,0,1,0,"Selection Bias: “उनकी पार्टी तीसरी धारा के रूप में चुनाव लड़ेगी।” Framing Bias: “तीसरी धारा की राजनीति करेगा भाजमो : सरयू राय” Linguistic Bias: “तीसरी धारा” Fact Bias: “संकल्प पत्र में 18 बिंदु हैं, जो शिक्षा, स्वास्थ्य, कृषि, उद्योग, जनजातीय कल्याण से लेकर लोक संस्कृति बचाने की बातें करते हैं।”",yes,0,0,1,1,0,1,0,0,1,
Live Hindustan,2024-05-14 16:59:39,https://www.livehindustan.com/uttar-pradesh/story-pm-narendra-modi-will-not-do-hindu-muslim-politics-says-it-is-his-resolution-else-will-not-remain-competent-for-public-life-9990189.html,no,0,0,0,0,0,0,0,0,0,,yes,0,1,1,0,0,0,0,0,1,representation of direct quotes and interviews which covers bjp in good light and congress in bad light
Live Hindustan,2024-06-11 21:25:39,https://www.livehindustan.com/uttar-pradesh/story-rae-bareli-amethi-has-given-the-message-of-clean-politics-not-only-to-up-but-to-the-entire-country-priyanka-gandhi-s-target-10203901.html,yes,0,1,1,1,0,1,0,0,0,"हमने सभी ने कहा कि 2–3 घंटे सोने के लिए रखिए। बाकी समय काम करिए। सबने यही काम किया। उसका परिणाम रहा कि यहां की जनता ने राहुल गांधी को भारी मतों से जिताया। सभी के आभारी हैं। उन्होंने कहा कि जितनी निष्ठा से आप ने जिताया है, उससे दोगुनी निष्ठा से आपके लिए काम करेंगे।",yes,0,0,1,1,0,0,0,0,1,
Live Hindustan,2024-06-11 22:34:39,https://www.livehindustan.com/national/story-mohan-majhi-son-of-security-guard-how-achieve-such-big-position-in-politics-what-he-say-on-being-nominated-cm-10204160.html,yes,1,0,0,0,0,0,0,0,0,,yes,1,0,1,0,0,0,0,1,0,caste based politics or economy based politics shown as inspiration
Live Hindustan,2024-06-11 23:00:39,https://www.livehindustan.com/uttar-pradesh/pratapgarh-kunda/story-politics-intensifies-over-the-murder-of-madrasa-operator-10204830.html,no,0,0,0,0,0,0,0,0,0,,no,0,0,0,0,0,0,0,0,0,
